Review,Classification,Disgust,Disappointment,Sadness,Confusion,Anger,Fear,Indifference,Surprise,Interest,Happiness,Touched,Motivation,Reflective
"This movie earned every one of the ten votes I gave it! Thank you guys for making a movie worth watching. You showed the world,you can still write, direct, produce and star in a black movie without the negative stereotypes. The poetry was awesome as well, hats off to the poets and musicians.<br /><br />I watched it last night, as I fell in love with my darling all over again. I will be adding it to my movie collection today, and recommending it to my friends and family.<br /><br />Please continue to produce quality, don't worry about the quantity....<br /><br />Thank you again, and best wishes and blesses to you!",positive,0,0,0,0,0,0,0,0,1,1,1,0,0
"Encompassing virtual reality, the potential of computers, communication with the past, the ongoing struggle to express your identity in a constraining society, and the fascinating Ada Byron Lovelace portrayed by the fascinating Tilda Swinton, this film should have been great. But it is lousy, terrible if you consider the potential! The acting - aside from Tilda Swinton and Karen Black - veers from tolerable to atrocious. The plot construction is awkward to say the least - the modern day programmer is a dull one-note character, but half the movie is spent setting up her character, and then when Ada finally appears, it is to narrate the events of her life, not to present an engaging story (Swinton almost pulls this off, though). You never fully get to know her as a real person, just an icon from a grad student's history paper.<br /><br />The digital effects, such as a digital dog and bird, are lousy and distracting, considering it was 1997 and not 1985. And, finally, the script is just bad. Bad, often pretentious dialog - especially the fights between the programmer and her boyfriend, which made me squirm - cold and distant characters, and zero attempt to create a sense of wonder. The programmer successfully contacts a person in the past! Astonishing! But it hardly seems to surprise anyone, and her boyfriend says, ""Well, be careful."" (Although we're given no clue then or later why it might be dangerous, and it never seems to actually be dangerous.)<br /><br />Also, despite being about computers and Ada Lovelace and her love of mathematics, it is clear no one involved with the script had any knowledge of mathematics OR computers - any references to these subjects come across as complete mumbo jumbo that defies any suspension of disbelief.<br /><br />One scene, towards the end of the movie, is quite good, a monolog by Tilda Swinton expressing her sadness at the fragility of life but her joy in that life. Poignant, passionate, and insightful, it seems to be dropped in from another movie.<br /><br />So I am disappointed in this movie, because it is a missed opportunity for a fascinating little cult film. If you find the subject matter interesting, you might want to rent it, but be forewarned. See Orlando for another, much much better examination of gender roles in history with a great Tilda Swinton performance.<br /><br />***spoiler/question: * *<br /><br />At the end of the movie, Ada asks that her memories not be preserved (in what I thought was the best scene in the movie). But then the modern day programmer seems to do it anyway, transferring the memories into her little girl (hence the title of the movie). Am I correct, that the programmer violated Ada's wishes without even struggling over it? Or is this another confusing plot point that I'm misinterpreting?",negative,0,1,0,1,0,0,0,0,0,0,0,0,0
"This thought long lost flick sometimes comes available on the web. So I bought me a copy. Well, of course the acting is terrible and the story line is childish but it does have his moments. I think people who searched this one also knows the backstory of it. It was made by a grindhouse cinema owner for an extreme low budget. But for me he surely didn't spoiled the money on props but on the make up. The make up is for that kind of flick well done. The zombies are watchable and the gore is intact. The only problem with that kind of movies is the quality of the pelicule. It's terrible, luckely no hiss on the sound but sometimes it's way too dark. So you have to watch clearly to see the gore. In a funny way they tried to sell this one as really not for the squeamish. A voice-over tells in the beginning of the movie to watch out for a sign and a man appearing with green flashes, that tells you there is gore on the way. Of course that doesn't work, made me think of Cannibal Girls, had that annoying bell when the red stuff started to flow. They had the original idea, Cannibal Girls was made a year earlier. Don't go for the storyline, go for the zombies and notice a continuity mistake. When the girl and guy are making love first she takes of her bra, then they make love and suddenly her underwear is back on...try to do that, or am I getting a bit offline,...eat it you ugly corpses",negative,1,1,0,0,0,1,0,0,0,0,0,0,0
"If you have seen the Sholay of 1975, Don't watch this movie. If you have NOT seen the Sholay of 1975, Go WATCH IT. But do not watch this movie. This movie has all the ingredients that could possibly have gone wrong with making a remake of Sholay. <br /><br />Amitabh 'Babban' Bachchan plays the role of a psycho villain to the best (Probably the only 40 mins of the reel that shouldn't be burnt). If you remove the rest of the movie and just watch amitabh play around with his character, it would still be worth a watch. But as Insp. Narsimha, Mohanlal doesn't do justice to his talent. Ajay Devgan(Heero) is extremely mundane and the only reason i think, they cast Prashant Raj in the role of Raj is because he has a striking resemblance to Amitabh of his young days. Sushmita Sen carries herself well, with grace and make-up. But the award for the ""WORST performance and any role till date"" must go to Nisha Kothari. She manages to degrade her acting to such levels that even high-school drama would would outshine her performance.<br /><br />If you have a mortal enemy, take him to this movie. :)",negative,0,1,0,0,0,0,0,0,0,0,0,0,0
"A well-intentioned movie about Sonja Horowitz (Ren茅e Zellweger), the wife of devout Talmudic scholar Mendel (Glenn Fitzgerald). who is deeply unhappy. Mendel's brother Sender (Christopher Eccleston) sees this and hires her to work in the field in which she's already an expert聴jewelry. He also starts an affair with her, and then when she spends time with a Puerto Rican artist, he dumps her and betrays her to the family, which shuts her out. There's a subplot in which Sonja's dead brother talks to her, and apparently takes the form of a magical beggar woman, but why is not clear. Much is not clear, unfortunately, including what is going on with Sonja, why she tells the Rebbe there's a fire inside her and maybe it's not from god, and what this means, and what the magical beggar woman tells her means. To an extent the story touches on the plight of women in the ultra-orthodox community, and yet Sonja is not exactly liberated. Nor is the notion of being redeemed by the love of a man of another race very well-thought-out. The title comes from the biblical definition of the worth of a good woman聴and yet it's the bastard Sender who quotes it to Sonja. Zellweger struggles with the part; she's supposed to be a Jew from the mid-west and sometimes her accent is flat, and at other times it's taken on the characteristic sounds of Brooklyn. She's at her best when she's being tough and taking charge, but ultimately the movie's a mess.",negative,0,1,1,0,0,0,0,0,0,0,0,0,1
"I seems in the beginning a interesting film, a Spanish thriller in a interesting nowadays Madrid, but it isn`t none of that, is actually a film only interesting for future films directors learning about what not to do making a film, it can`t be worse in others words, even the presence of a oscar winner ( Mira Sorvino ) isn`t enough to justify the $ 3.00 dollars expended to see this film , the acting is horrendous and it seems the actors were just waiting to finish the daily shots to go home, it lead to nowhere and is boring, weak and bad, don`t expend time or money on this film.",negative,0,1,0,0,0,0,0,0,0,0,0,0,0
"This is a horrible movie. All three stories are bracketed with a psychiatrist hypnotist line which is unnecessary and all the stories are bad. The first is about wild wolves and some lady, there are some things that don't make sense, but the hypnotism thing makes up for that. The second one, with bad Bill Paxton as a maniac roommate should not be viewed by anyone. The last one, sadly the best is almost incomprehensible which I guess makes it better than the other garbage.",negative,1,1,0,1,0,0,0,0,0,0,0,0,0
"Revenge of the Sith starts out with a long action sequence that is impressive without being terribly exciting, then gets really boring for the next hour and fifteen minutes, with the same horrible dialogue and dull machinations that have plagued the rest of the prequel series. The only thing that improves the proceedings is the slow--and I mean slow--build-up to what we know will be the birth of Darth Vader. And when that finally comes, it's pretty all right. Not great. Not even good. But pretty all right. This movie is being vastly over-praised because it does not suck to high heaven like the previous sequels. Instead it's just turgid, dull, and routine. But you have to say, wow, those CGI environments are really impressive at times. Bu the lightsabre fights? They're all a blurry mess. I think the dark side took hold of Lucas when he started these prequels and no one noticed. This will make a ton of money, but thank god it's over, this once-worshipped franchise has been beaten down enough. I saw the 12:01 show, and after it, I heard a group of very small kids say, wow that was awesome! But everyone older than eight all grumbled the same thing: I fell asleep in the middle. It was kind of boring. I just thought seeing the birth of Darth Vader would be better. So said we all.",negative,0,1,0,0,0,0,1,0,1,0,0,0,0
"This movie has no plot and no focus. Yes, it's supposed to be a slap-stick, stupid comedy, but the screen-writers have no idea what the movie was about. Even the title doesn't go along with the movie. It should have been called ""Cool Ethan"" or ""Cheaters Never Win"" or something like that. The characters are not developed and no one cares what happens to them! The girl roommate character (from That 70's Show) was the only person worth watching. She was hilarious and stole every scene she was in. The others need to make sure that their own college diplomas are in the works since they'll need a career other than acting.",negative,0,1,0,0,0,0,1,0,0,1,0,0,0
"A top notch Columbo from beginning to end. I particularly like the interaction between Columbo and the killer, Ruth Gordon.<br /><br />As an avid Columbo fan, I can't recall another one in which he doesn't set up the killer at the end as he does in other episodes. In this one, as he's trying to determine the correct sequence of the boxes and the ""message"" that the nephew left behind, it finally dawns on him.<br /><br />The music in this episode is very good as well, as it is in many of other ones.",positive,0,0,0,0,0,0,0,0,1,1,0,0,0
"Not worth the video rental or the time or the occasional efforts.<br /><br />*Makeup that a child can do. *Acting was over done...poor directing. *Editing was very choppy...many things made no sense or just seemed gratuitous. *Sound was badly dubbed. *Music was highly inappropriate. *Casting was extremely off...must have been on crack. *Zombies that talk let alone...drive, dance, work...just pisses me off. *And the bad guy...Holy Crap! As horribly casted as he was...he was the best looking zombie of all. Which doesn't say much.<br /><br />The Cover Art was good but very deceiving...as was the Main Menu of the DVD...great artwork and music.<br /><br />DON""T BOTHER!",negative,0,1,0,0,0,0,1,0,0,0,0,0,0
"Supposedly a ""social commentary"" on racism and prison conditions in the rural South of the 1970's, ""Nightmare"" is full of bad Southern stereotypes, complete with phoney accents. Not only would it be offensive to the sensibilities of most American Southerners, this tawdry piece of work comes off as just a thinly-disguised ""babe in prison"" movie--especially in its uncut original version. Nevertheless, acting is generally above average and the late Chuck Connors, in particular, does a good job of making viewers hate him--even though he looks somewhat uncomfortable in several scenes. There's also a change-of-pace role for the late Robert Reed, who appears as the lecherous warden, and Tina Louise (previously Ginger of ""Gilligan's Island"") made a rather believable sadistic prison guard. My grade: D. <br /><br />",negative,1,1,0,0,1,0,0,0,0,0,0,0,0
"The storyline was okay. Akshay Kumar was good as always and that was the only good thing about the movie. Kareena Kapoor looked bad. There was so hue and cry over her size zero but she did not looked good leaner. I don't know why the hell did Anil Kapoor accepted such a bad role. There was nothing much to do for him in the movie. Just because it is a Yashraj film does not means that an actor should accept the role however bad it is. Said Ali khan was alright. I think that it is high time that Indian directors and producers start thinking of Indian customers as intelligent lot. What are we ? fools!!!! What do they think, they will show 2 men taking on a SWAT squad to teeters and we will believe them. Is the Indian police so stupid that they are trying to nab some criminals.... they take an entire squad of 100 + policemen and no one was there to surround the palace. The action was crap and I have never seen such bad action. Akshay Kumar was between a circle of 30-40 policemen all shooting at him..... and he shooting back at them. None of the policemen's bullet touched him but he killed all the policemen. Crap. CRAP.<br /><br />I think the fight director who thought of this scene should take retirement.<br /><br />I strongly recommend NOT TO SEE THIS MOVIE.",negative,1,1,1,0,1,0,0,0,0,0,0,0,0
"This type of plot really does have a lot of potential, but it was butchered here. Honestly, I sensed the cheese element in the beginning, but I thought it would get better after the grotesque birthing. Whoa, I was wrong! So mad scientist makes a monster, wants to brag to his old cronies before he kills them, but of course they escape. After that, it's really bad. I should've counted the times the rubber shark mask peeked out from behind some foliage, but I most likely would have lost count.<br /><br />Pan down to the blood-dripping-from-severed-leg to show us how the shark-man finds the folks. I hate being spoon-fed every aspect of a horror film.<br /><br />Oh, and after being nearly killed by a mutated shark-man and trudging around a jungle-esqe island, there's nothing more cheerful than a middle-aged man reciting Shakespeare...<br /><br />This is one where you'll find yourself rooting for the monster... if you can bear to watch this poor excuse for a flick.",negative,1,1,0,0,0,0,0,0,0,0,0,0,0
"A famous orchestra conductor, Daniel Dareus, suffers what appears a heart attack as he finished conducting a concert. Suddenly, we watch him as he arrives in the small town that he has left years before. Since he left so young, and having his name changed contributes to give him a new persona. He has bought the old school building where he plans to stay. The building needs a lot of work. One would expect a man in his position to have all the comforts of the world he left behind to be installed in his new abode, but no, Daniel puts up with the harsh winter in his own way.<br /><br />The local pastor, Stig, whose church has a small choir, comes calling to see if he can interest Daniel in helping, but the conductor has no desire to go back to music. Daniel begins to explore his new universe. The town's people leave him alone. He makes an impression on Lena, who works in the local store where he goes to get his food supplies. Little by little, he comes around and decides to involve himself with the choir. Lena will ultimately fall in love with Daniel.<br /><br />At first, the relationship between Daniel and the choir members is not exactly what he expected. As they get to know him better, they come around to accept him and make him one of them. His new position doesn't endear him to the woman who used to be in charge. The members of the choir are a motley crew, but they realize the change Daniel has made in the way they interpret different songs. The new piece composed for Gabriella, a battered wife, makes a great impact in her life and that of her fellow singers.<br /><br />Daniel's ideas for the repertoire clash with Stig's own. The vicar suddenly begins seeing Daniel in a new light; he is a tormented man who likes to read pornographic magazines before making love to his wife, Siv. His ideas clash with the dogma, as Siv points to him. Stig decides to try to put a stop to what he considers an unhealthy influence of Daniel by firing him as the head of the choir.<br /><br />The choir, which has been invited to participate in a competition travels to Austria. Daniel, who by now has fallen totally for Lena, has a chance to show for the first time in his life his feelings for her when she starts to gets doubts about their relationship. Daniel who is late for his own concert, gets to hear them making extraordinary music even though he is not in among them.<br /><br />Kay Pollak, the director of this enormously appealing film, shows he was the man to direct it. The story involves the viewer from the start. Great part of the success of the movie goes to the ensemble cast that was put together. William Nykvist, who plays the leading role is the best excuse for watching the film. Frida Hallgren, Niklas Falk, Ylva Loof, do excellent work for Mr. Pollak.<br /><br />Stefan Nilsson is the composer for most of the beautiful music one hears. Harald Gunnar Paalgard's cinematography makes the film look better capturing different seasons for the viewer in their beauty.",positive,0,0,0,0,0,0,0,0,1,1,0,0,1
"Recap: Full moon. A creature, a huge werewolf, is on the hunt. Not for flesh, not for blood (not that it seem to mind to take a bite on the way though), but for a mate. He is on the hunt for a girl. Not any girl though. The Girl. The girl that is pure (and also a werewolf, although she doesn't know it yet). Three, well check that, two cops (after the first scene) and an old bag lady is all that can stop it, or even knows that the thing killing and eating a lot of folks around full moon is a werewolf. This particular powerful werewolf, Darkwolf, is closing in on the girl. If he gets her, mankind is doomed. Now the cops has to find the girl, convince her not only that there is someone, a werewolf nonetheless, that wants to rape her, and perhaps kill her, but that she is a werewolf herself. And then they got to stop him...<br /><br />Comments: This is one for the boys, the teenage boys. A lot of scenes with semi-nude girls more or less important for the plot. Mostly less. Well I guess you need something to fill some time because the plot is (expectedly) thin. And unfortunately there is little besides the girls to help the plot from breaking. One usually turns to two main themes. Nudity. Check. And then special effects. Hmm... Well there are some things that you might call effects. They're not very special though. In fact, to be blunt, they are very bad. The movie seems to be suffering of a lack of funds. They couldn't afford clothes for some of the girls ;), and the effects are cheap. Some of the transformations between werewolf and human form, obviously done by computer, are really bad. You might overlook such things. But the Darkwolf in itself is very crude too, and you never get to see any killings. Just some mutilated corpses afterwards. And there is surprisingly little blood about, in a movie that honestly should be drenched in blood.<br /><br />I'm not sure what to say about actors and characters. Most of the times they do well, but unfortunately there are lapses were the characters (or actors) just looses it. A few of these lapses could be connected with the problems mentioned above. Like the poor effects, or the poor budget(?). That could explain why there is precious little shooting, even if the characters are armed like a small army and the target is in plain sight (and not moving). But hey, when you're in real danger, there nothing that will save your life like a good one-liner...<br /><br />Unfortunately that can't explain moments when the Cop, Steve, the only one who knows how to maybe deal with the problem, the werewolf that is, runs away, when the only things he can be sure of, is that the werewolf is coming for the girl, who is just beside him now, and that he cannot let it have her. But sure, it let the makers stretch the ending a little more...<br /><br />But I wouldn't mind seeing none of the lead actors/actresses get another try in another movie.<br /><br />Well. To give a small conclusion: Not a movie that I recommend.<br /><br />3/10",negative,1,1,0,0,0,0,0,0,0,0,0,0,0
"This was one of the best shows ever made for TV. Full of mystery and intrigue and twists and turns. Compulsive viewing. I was lucky I saw this in the UK. They might have got the episode order wrong, I can't remember, but it at least was on at a regular time every week. My girlfriend and I got hooked from the trailer in, and neither of us is a big fan of American series normally.<br /><br />After the pilot, we knew this was something special. We missed a couple of episodes, and it made you sad and mad for a week missing those ones lol.<br /><br />Great casting, superb acting. Gary Cole was absolutely brilliant, better even than his role as Custer. Lucas Black turned in an amazing performance for a kid, and Paige Turco was at her best too since Party of Five. And Nick Searcy of course, as the Sheriff's long suffering sidekick.<br /><br />Yes, there were some confusing and perplexing bits, which I presume would have been explained later, and no doubt would have been in a later series. That made the ending weak, and you could tell they'd killed it. Made us go WHAT? Why did they do that with one of the best shows ever? Shoot the exec.",positive,0,0,0,1,0,0,0,0,1,0,0,0,0
"While i was the video store i was browsing through the one dollar rentals and came upon this little gem. I don't know what it was about it but i just had a gut instic about it and wow was i ever right.<br /><br />The story centers around two girls who have just survived a school shooting. One of the girls is Alicia a teenage reble who is the only witness for the full attack and another is Deanna another survivor who survived a bullet to the head by some miracle. Thrown together by fate, they slowly begin a painful and beautiful display of healing and moving on.<br /><br />I just hate it when amazing movies fall through the cracks. Because wow what a performance by Busy Phillips and Erkia Christensen not to mention the rest of the cast! My only complaint is that the DVD was sorely lacking in special features. Oh and some of the jump cuts in the movie were kind of jarring. But all in all a excellent movie.",positive,0,0,0,0,0,0,0,0,0,1,0,0,0
"the intention the directors has for this films are quite honorable, but his history of his productions did get me aware that this might not get much to the core like other film makers would do it. keeping his great 30 days TV series in mind but also counting in his MTV production ""i bet you will"" that opposes his seriousness in any of the matters he documents and also counting in his rather disappointing production ""supersize me"" i did not had my hopes up high. sadly enough this movie disappointed me none the less. as with ""supersize me"" after a while i did ask myself what exactly the point of all this was. the main statement gets clear enough after half an hour but the rest of the playtime gets filled with rather pointless stuff and re-repeating stuff that were already shown in this way or another earlier in the movie, so it wears out and gets extremely boring towards the end.",negative,0,1,1,0,0,0,1,0,0,0,0,0,0
"It's 1978, and yes obviously there are too many black players on the teams as well! Fans will be upset and certainly the 75,000 seats will be full, only less happy there are so many black players on the field! This made for TV Super Bowl movie is watchable. It's not much more, but it's really surprising the cast of talented actors that make an appearance (for the time), probably most notably Tom Selleck. Unfortunately any goodness Selleck brings to the screen, is quickly trumped by ""actors"" like Dick Butkus.<br /><br />It's a silly story about super bowl betting. PJ Jackson is charged by ""New York"" (read mafia) for ensuring the game ends for their favor, in this case a $10,000,000 bet. PJ is innocent enough, and seems to have a loose grasp by buying off a few people here and there. But things seem to fall apart for him. Another person, the unsuspected Lainie, takes charge. For a while, the mystery of murders isn't known for certain, but is revealed rather plainly at the final murder that Lainie is the new antagonist.<br /><br />It's a bad movie, but is watchable. The acting is decent, and the filming is OK. At least there weren't any silly typical 70s car chases (they have their place just not here). Just keep an open mind about past stereotyping and the cocaine era and you'll survive.<br /><br />2/10 (maybe a 2.5)",negative,0,1,0,0,0,0,1,0,0,0,0,0,0
