Review,Classification,Disgust,Disappointment,Sadness,Confusion,Anger,Fear,Indifference,Surprise,Interest,Happiness,Touched,Motivation,Reflective
"Loony Tunes have ventured (at least) twice into the future. The first time was with the brilliantly funny ""Duck Dodgers"". The latter time was with this 聟 um 聟 effort. ""Loonatics Unleashed"" isn't without merit, and might be considered a good product were it not that it isn't up to Warner Brothers quality. WB cartoons are noted for their cheeky humor, appealing at least as much to adults as to children. These pedestrian superhero episodes, on the other hand, cannot fail to convince adults to pass them up.<br /><br />The premise of the series is that 6 ordinary individuals (2 bunnies, a Tasmanian devil, a duck, a roadrunner, and a coyote) live on the ""city-planet"" of Acmetropolis and acquire super powers when a meteor strikes the planet in 2772. What's confusing is that the titles section features these individuals with a count-up to 2772 from the 21st Century. Cute, but frelling stupid.<br /><br />In each episode, the super sextet 聳 amid mildly amusing but essentially banal banter 聳 fight various super villains. For the most part, these are types that appear in every mediocre superhero adventure series and even some of the better ones. Like many mediocre superhero series, this one takes its villains far too seriously for the context. And of course these guys are the only characters that laugh 聳 the usual evil laugh, of course. Why is it that villains in predictable superhero adventures always 聳 ALWAYS 聳 laugh evilly at every opportunity? Animated material of this sort seems to leave laughter exclusively in the province of villains and (occasionally) their henchpeople and/or henchthings.<br /><br />In point of fact, the makers of this series missed their best bets right from the get-go. The superpowers of the characters are sometimes based on their previous normal abilities, but sometimes not. The problem here is that we don't see enough WB looniness. Lexi and Ace have fairly ordinary biologically generated energy weapons and have virtually no personality traits one could describe as ""Bugs-like"". What we have here is basically the silly and drekish ""Teen Titans"", including its overly ""modern"" animation ""look"", but with animals. Feh.<br /><br />The other misstep by the program's creators is (or are) the villains. As noted before, these are not terribly imaginative and do the evil-laugh bit excessively. Amazingly, the writers totally missed the obvious technique of making villains from stock WB characters as well as the protagonists. Adding to the fun could have been, say, Jupiter Sam 聳 as well as The Fudd, still hunting wabbits 聳 as well as Tech E. Coyote converted into a really neurotic villain 聳 and so on. Ah, the sadness of missed opportunities聟.<br /><br />Sadly, this whole production has gone into too much overtime (that is, a 2nd season). Nevertheless, we can rejoice that there's something new out there for the 14-going-on-9 crowd. The rest of us can hope for a 3rd season of Duck Dodgers.",negative,0,0,0,0,0,0,0,0,1,0,0,0,0
"A detective (Dana Andrews) with a reputation for violence accidentally kills a suspect in a murder (Craig Stevens) and then tries to cover it up. The Otto Preminger directed film has plenty of atmosphere but the story gets watered down when the dead man's wife (Gene Tierney) falls for Andrews. He was doing fairly well digging himself into and out of a big hole, but she was just too much light at the end of the tunnel for a noir film. Gary Merrill is great as Scalese, a crime boss that Andrews is obsessed with bringing down, and the tension between them gives the film its energy and drive, especially a scene in a bath house with Merrill, Andrews, and Neville Brand, and the night time rendezvous outside of Bellevue Hospital, that sets up what ought to have been the film's conclusion. High marks for atmosphere, Andrews, Merrill, etc... and the general portrayal of the underworld, though the love angle and the simplistic good cop bad cop elements don't help its cause.",positive,0,1,0,0,0,0,0,0,0,0,0,0,0
"Before seeing this movie, I would've said that I loved everything Kathy Bates has done. Now it's everything-minus-one. James Woods is pathetic...not his character, his acting. Someone should've told him that ""poor"" is not synonymous with dirty, nor ignorant, nor cliche. Ditto for Randy Quaid's stereotyping. The only redeeming feature is Henry Thomas, who isn't a strong enough actor to carry this sodden mess. If you enjoy the country, you'll enjoy the scenery. That's the best I can give it.<br /><br />I'm a serious fan of both independent and quirky films, but this is simply terrible.",negative,1,1,0,0,0,0,0,0,0,0,0,0,0
"A family moves into a old house in Japan. But there's a catch it's haunted (BOO!!!). Aw, didn't mean to make you jump. It's only a review. Settle back down. Ahem, now anyways it's haunted by an old samurai who killed his wife & her lover in slow motion. This naturally makes a 3 minutes scene stretch out to about 7 or 8. Horrid acting. Horrid story. But How bad can it be you ask? Well it was SO bad my brain started to melt & leak out through my nose in thoughtful drips. It was SO bad whenever Doug McClure came on-screen I prayed that i had flashbacks of Small Wonder (Yes, i know Doug was in ""Out of this world"" & not ""small Wonder"", but it's pretty much the same damn show, & i can hum the ""small wonder"" theme better) There are movies that are so bad they're good. this isn't one of those<br /><br />Where i saw it: Showtime Beyond<br /><br />My Grade: F-<br /><br />Eye Candy: Mako Hattori gets topless,Susan George gets 2 love scenes ( one nude, one just topless)<br /><br />",negative,1,0,0,0,0,0,0,0,0,0,0,0,0
"First I want to clarify that the average user's inability to appreciate imagination is appalling. What makes this show so unique is the hyper-reality it creates. You don't need to know why Ned can bring people back from the dead, or why it can only be for a minute. Where has the wonderment of childhood whimsical tales gone, much like A Wrinkle in Time.<br /><br />I say it is refreshingly original because it is a polar opposite to the masses of lay-it-all-out television that leaves no room for imagination or wonder.<br /><br />It's nice to add a bit of escapism to the television experience.<br /><br />The hyper-reality is my favorite aspect of the show. The 1950's-esque setting, the innocent and rare characters, and the scenery and physical setting which are not meant to be taken as pure reality.<br /><br />This show masks the morbid nature of death, while others embrace it. While entertaining, other television shows have taken a back shelf to this series. It truly has restored a sense of curiosity, imagination and wonder to television.<br /><br />Pushing Daisies quickly made it to the top of my list.",positive,0,0,0,0,0,0,0,0,1,1,0,0,1
"Grand epic as it is, Kenneth Branagh's monumental rendering of what is perhaps William Shakespeare's most popular tragedy suffers under the weight of its four hour playing time and certainly takes some real staying power. Two entirely separate sittings would most likely be better in order to fully appreciate what is certainly high class film making. While I absolutely acknowledge this masterpiece as such, I must confess to a lack of enthusiasm for the old bards flamboyance, his rhetoric (and he sends himself up so well) and his many flourishes. Thus ""Hamlet"" loses its impact as it loses its grip.<br /><br />From Patrick Doyle's music to Alex Thomson's cinematography to Tim Harvey's exquisite sets, the movie is a feast of visual and aural delights, which compliments a fine cast. Branagh has taken on three huge mantels, adapting, directing and playing. His adaptation is superb, his direction strong, but by the time he got to the role of Hamlet, the strain seemed to be showing; yet still he does a fine job in what is an incredibly taxing role. Derek Jacobi gobbles up the sinister Claudius with glee, and Julie Christie is most dramatic as his queen, Gertrude. Richard Briers is marvellous as Polonius, and Charlton Heston is once again a strong screen influence as the player King. Many others drop by, including Jack Lemmon (superb in a very small role), Billy Crystal, Dame Judi Dench, Sir John Mills, Sir John Gielgud, Sir Richard Attenborough and Gerard Depardieu. The acting prize though must go to one of the great thespian discoveries of recent years, Kate Winslet. Hers is a moving portrayal of the most tragic figure in this whole affair, Ophelia.<br /><br />To finish (before this review goes on longer than the film), I must say it is the length that really tests the viewer in this movie. Branagh has directed with purpose, giving many important, impacting scenes. Too many of them outstay their welcome. Watching this film holds a fantastic reminder of the many pearls of wisdom we have garnered from it. ""Neither a lender nor a borrower be"" or ""Be true to thyself"". And of course: ""To be or not to be"".<br /><br />The opening two hours does take some perseverance, but if you do manage to stay tuned you are sure to be treated to a rousing finale which gathers momentum from the tragic funeral onward.<br /><br />Monday, June 8, 1998 - Hoyts Croydon",positive,0,0,0,0,0,0,0,0,1,1,0,0,1
"This movie (with the alternate title ""Martial Law 3"" for some reason) introduced me to Jeff Wincott for the first time. And it was a great introduction. Although I had never heard of him before, he seemed to be an excellent fighter. The action scenes in this movie are GREAT! There are lots of them too, by the way. The recruit fight at the Peacekeepers HQ is especially good. There's just something about one single guy beating the crap out of a bunch of people that's really fun. And for the rest of the cast: Brigitte Nielsen was a good choice for the villain. Roles like this fits her (but others don't). Matthias Hues also did a good job, as always. He's a great fighter and macho-like character, and was a good rival for Wincott in this movie.",positive,0,0,0,0,0,0,0,0,1,1,0,0,0
"OK another film bought by me and Joe Swatman. OK this isn't the worst film i've reviewed this week but it still sucked royaly. we had a lot of fun watching this piece of crap.<br /><br />The Monster Jigsaw is a mish mash of all these dysfunctional students ideas, u just know ur in for trouble when someone equips him with a buzzsaw and a sawed of shotgun, the film wasn't as gory as we hoped, i mean on of the deaths is a heart attack. Again i think the acting sucks, sum of the actors must be porn stars and one get into her undies for what ever reason. <br /><br />The absolute worst part is the ending, it leaves it open for a bit of a Jigsaw 2 but thats never gunna happen lets face it.<br /><br />My ratings:<br /><br />funny 4/100 mock (how much fun we had mocking it) 73/100 acting 8/100 generally 12/100",negative,1,0,0,0,0,0,0,0,0,0,0,0,0
"Two qualifiers right up front: I actually think Joe Don Baker can be good or even great with the right material and the right director (the ""Cape Fear"" remake, a small role in ""Goldeneye"", ""Walking Tall""). And I even liked Baker in ""Mitchell"", because he was playing an anti-hero who was SUPPOSED to be unlikeable. Yes, MST3K's coverage was hilarious, but they took a lot of cheap shots at Baker - that he didn't deserve - to keep things lively and entertaining - he was appropriate to the level and tone of the movie, and he was the best part of the movie.<br /><br />""Final Justice"" seems to be more of the same, but in spite of the exotic locations and the ""cowboy frontier justice"" theme, it is quite a bit weaker than ""Mitchell"". And the main reason is that Baker's character, as written, is an idiot. The movie has the conceit that because Baker embodies old style frontier machismo, he challenges his opponents to old style mano-a-mano quick-draw contests. And because he's so tough and macho, he always wins, even when he's hurt, wounded, outnumbered, etc.<br /><br />That's a conceit with a lot of potential (it worked for Gary Cooper), even if it condemns the film to ""B"" movie status. But Baker is so frigging stupid and obsessive that he needlessly challenges three of the bad guy's henchman to a showdown in a public market, with civilians all over the place. He COULD have simply shadowed them to the chief bad guy's headquarters (which was why he was following them in the first place) and they never would have noticed. Or he could have gotten the drop on them and forced them to surrender, and gotten one of the henchmen to take him to headquarters at gun point. But no, he has to be a bush league hot dog and a macho blockhead, and so he gets a child taken as a hostage in the ensuing shootout! <br /><br />This is a guy we are supposed to admire? <br /><br />The whole movie is basically like this. Most of the supporting actors are somewhere between OK (the henchmen) to pretty good (the chief bad guy and his father, who are two well known European actors - they just go through the motions, but they are pros and even hamming it up they are decent). But through it all, Baker's character pulls silly , unproductive stunts and mistakes that get at least two relatively innocent people killed, plus a couple of bad guys who might have been taken alive without the use of deadly force.<br /><br />On the positive side, since 90% of the movie is set on Malta or in the Mediterranean, you get to see lots of pretty scenery and lots of nice and exotic looking extras. And really, Baker himself may be on the heavy side and slightly dyspeptic, but he isn't that bad...certainly not the tub o' lard that this films critics (including Mike and the Bots in their hilarious coverage) seem to think.<br /><br />In short, this movie is good for video wallpaper, but the viewer should not pay any attention to it.",negative,1,1,0,0,0,0,0,0,0,0,0,0,0
"This must be accompanied by a special rating and warning: NOT RECOMMENDED TO NORMAL PEOPLE.<br /><br />The obsession of Daneliuc with the most dirty body functions becomes here a real nightmare. Also, it's evident that the man is a misanthrope, he hates everybody - his country his people, his actors, his job. And this hatred makes him blind and he forgets anymore the profession he knew long ago.<br /><br />This so called ""film"" is just a hideous string of disgusting images, with no artistic value and no professionist knowledge. It is an insult to good taste and to good sense. Shame, shame, shame!",negative,1,0,0,0,1,0,0,0,0,0,0,0,0
"""Thieves and Liars"" presents us with a very naturalistic depiction of the levels of corruption that affect many Puerto Ricans and force them to make difficult if not impossible choices about their and their loved ones' lives. The cast is excellent, considering that some are non-professional actors; an excellent choice that augments the level of reality in the film. The photography propels the story without intrusion, as it should be in this type of film. The script captures the idiosyncrasies and attitudes of the ""Boricuas"" in a very deep way. Sometimes it feels like you're watching a documentary! Watching this film you feel as if you've secretly entered the real Puerto Rican society and stand invisibly watching it implode. I loved it!",positive,0,0,0,0,0,0,0,0,0,1,0,0,0
"I had seen this film way back in the 80's and had nearly forgotten it when I noticed it was on tv again and watched it. I remembered having liked this little sleeper when I first saw it, and I liked it even better on second viewing.<br /><br />All of the actors, especially Robert Duvall, Glenn Close, Wilfred Brimley, Frederic Forrest, and Jason Presson (as the twelve-year-old boy who feels responsible for the accidental shooting death of his older brother), are superb. The film has a very genuine feel to it--an understated, quiet, deeply moving story of a family aching with grief. The dialogue is sparse but telling, and the nonverbal acting is outstanding. Sort of like a simpler, rural version of Ordinary People sans psychiatrist but equally impressive family dynamics.<br /><br />The Stone Boy is well worth the time and emotional energy involved in watching it.",positive,0,0,1,0,0,0,0,0,0,0,1,0,1
"I was in second grade, 12 years ago. I remember it clearly. We were learning about space. All little kids want to go to space, right? Well, after I saw this, I was so scared to death that I would 'accidentally' get flung into space by some psychotic robot with a one track mind. I had no idea that this was a movie. I thought it was some news program or something. I guess it was my own version of when people were freaked out by the radio program 'War of the Worlds.' So, recently, I get this movie again to watch, realizing my favorite actor, Joaquin Phoenix was in it (then known as Leaf Phoenix). I can tell you, I was laughing at the dramatic parts and laughing even harder at the acting. I mean, when Andy is in space, she moves in slow motion, did you ever notice that? I don't think being in space makes you talk that slow or think that slow.<br /><br />The best part is when Andy is knocked unconscious by the oxygen tank, and begins to float backwards as the security doors close. Little Max is trying to pull her in. Suddenly, we get a major close up on Max's face as he shouts (in slow motion) ""Whaaaaatttt'ssss happpeniiiinngggg?!?!?"" I had no idea.",negative,0,0,0,0,0,1,0,1,0,0,0,0,0
"""This story is dedicated to women,"" according to the introduction, ""who have been fighting for their rights ever since Adam and Eve started the loose-leaf system."" When ""Politics"" was filmed, the Nineteenth Amendment, guaranteeing women the right to vote, was only a decade old. And, the film deals with the wielding of political power by women as a voting group. Advocating prohibition, and shutting down speakeasies, was a main concern for women at the time.<br /><br />Good-natured Marie Dressler (as Hattie Burns) becomes politically active, after a young woman is shot and killed coming out of a speakeasy. She wants the liquor-selling joints closed; and, is drafted into a Mayoral run, after delivering a powerful speech at a women's rally. Ms. Dressler is supported by her tenants, best friend Polly Moran (as Ivy Higgins) and her stuttering husband Roscoe Ates (as Peter Higgins). Dressler's run for Mayor of Lake City draws opposition from men in town; so, Dressler orders the women to go on strike, denying them, ""everything"" in the ""parlor, bedroom, and bath."" <br /><br />The film sounds much better than it turned out. The humor, frankly, isn't too good; and, it features some unfunny and moderately offensive situations (""You look like Madame Queen"" refers to an Amos and Andy character). And, the mixing of shootings and slapstick doesn't mix well, this time. Producers might have considered making the film more dramatic, focusing exclusively on Dressler and the characters played by William Bakewell (as Benny Emerson) and Karen Morley (as Myrtle Burns).<br /><br />**** Politics (7/25/31) Charles Reisner ~ Marie Dressler, Polly Moran, Roscoe Ates",negative,0,0,0,0,0,0,0,0,1,0,0,0,0
"Yep, lots of shouting, screaming, cheering, arguing, celebrating, fist clinching, high fiving & fighting. You have a general idea as to why, but can never be 100% certain. A naval knowledge would be an advantage for the finer points, but then you'd probably spot the many flaws. Not an awful film & Hackman & Washington are their usual brilliant, but the plot was one you could peg pretty early on. I'm still waiting to see a submarine film where people get on with each other & don't argue, but then you probably wouldn't have a film.<br /><br />4/10",negative,0,0,0,0,0,0,0,0,1,0,0,0,0
"This movie is just plain bad. It isn't even worth watching to make fun of it. The lunatic professor is just plain annoying. Even suspending disbelief to allow for invisibility (which I glady do for the sake of good bad movies) and allowing for exceedingly stupid victims in a horror movie, this movie asks for even more than that. If you are looking for women's locker room shower scenes, and random sexual encounters, get a porn, if you are looking for a good-bad movie, get something else. If you want to simply waste your time on an annoying bad movie, rent this.",negative,0,1,0,0,0,0,0,0,0,0,0,0,0
"I have just seen this film, and fallen in love with it. There is a little bit of something for everyone, and its a particular free for all when it comes to the romance between Lachlan and Lil. When they are on the beach, I nearly cried... there is the unspoken realization that time is the most precious commodity and it is most evident when they are together. This idea taken from several angles, from marriage to sibblings to finding love in the least conventional of places. The film almost makes you long for that kind of desperation when you know that tomorrow could very well be your last. Crowe was particularly wonderful in his role of Lachlan. I've always had a soft spot for the accent, but I nearly melted with his portrayal of his character. The way this film was shot is also beautiful, with the music, backdrop of the open fields, and superb acting. All together, this is a wonderful film that tugs at all of human emotions.",positive,0,0,0,0,0,0,0,0,0,1,0,0,0
"Please note that I haven't seen the film since I discovered it in 2007, and my town is smaller and doesn't carry it. However, I really want to say something about it. I'm actually doing research for university on the title character Richard Maurice Bucke and would like to point out that the person they based the main character on was in reality completely different!!! Hollywood's ideas of people and artistic license granted, the real Dr. Bucke totally endorsed hysterectomies to cure insanity in women, and would never have practiced anything as liberal as represented in the film. I think it's laughable to see various film critics who write for legitimate newspapers who say this film has some historical basis! The only actual fact I can see is the friendship between Dr. Bucke and Walt Whitman. Please don't waste your time on a film with such a disregard to the horror that real women experienced at the hands of this doctor who has now been glorified by the film industry.",negative,0,1,0,0,1,0,0,0,0,0,0,0,0
