Review,Classification,Disgust,Disappointment,Sadness,Confusion,Anger,Fear,Indifference,Surprise,Interest,Happiness,Touched,Motivation,Reflective
"For die-hard Judy Garland fans only. There are two (2) numbers that are really good -- one where she does a number with an older cleaning lady (you've all seen the pics), and a pretty good number at the very end. There are a couple of scenes where the lines are funny. But, basically, the script is so bad and the movie so dated that it's hard not to cringe at the awfulness throughout. But it's worth the 2.50 to rent the movie -- just be prepared to fast-forward it.",negative,0,1,0,0,0,0,1,0,0,0,0,0,0
"I really like this film... when I started to watch it I thought I would get bored pretty soon, but it surprised me... I thought it was a great film and have seen it a few times now. The characters are believable and I have to say that I fell in love with Brian Austin Green all over again (the first time being Beverly Hills 90210). I would recommend this film if you are a fan of his, but I do agree with another comment made earlier, that the ending is sort of disappointing. I would have loved it to turn out a little different! Never mind though, good gripping story.",positive,0,0,0,0,0,0,0,1,1,1,0,0,0
"This was my second time watching the film (via the French-language version as opposed to the first, which was dubbed in Italian) and I feel that it improves on subsequent viewings.<br /><br />A compelling if slowly built-up character study that's beautifully shot and with the Parisian settings being equally impressive. In the long run, it's not top-grade Polanski and I would rank it at number 9 in his filmography but it's still a confident mix of subtle chills and, surprisingly, often broad comedy. It also features a fine cast, all of whom are in good form, but especially Isabelle Adjani, Melvyn Douglas and Jo Van Fleet.<br /><br />Even so, I'm a bit baffled by the sudden compulsion for Trelkovsky to 'change' into the previous tenant; apart from the owner of the caf茅 opposite the apartment building, where he is given whatever Simone used to have without asking him if he wished any different, there is little to indicate (as far as I could discern, anyway) that this is what everybody wanted of him! Okay, so he found Simone's belongings still lying in the apartment but what exactly drove him to wear her dresses and make himself up as her (even if he apparently started doing this unconsciously)? Following his nightmarish visions in the bathroom, the last section of the film (where Adjani all but disappears) is almost anti-climactic - especially the scene where the landlord and the other tenants witness his attempted suicide as if it were a night at the Opera, a concept which had already been used 46 years earlier by Jean Cocteau in THE BLOOD OF A POET (1930)!<br /><br />The ending, then, is at once predictable and unresolved: just what made the two occupants of this particular apartment jump out of the window?!; I remember this factor bugging me on first viewing as well, and I'm sorry to say it's no clearer now! Mind you, the film's first two-thirds are pretty solid but I wish that Polanski had been less reliant on obscure plot points throughout.",positive,0,1,0,1,0,0,0,0,0,0,0,0,1
"This is one of the most spiritual movies I have ever seen. I headed up with about 150 people to St. George and we saw this movie in the visiting center of the St. George temple.. Not one person had dry eyes in the audience. Also, there were some non- religious and anti-Mormon people in the audience who felt the spirit of the movie and were touched by the captivating music and reenactment of the story of the pioneers and the hardships they faced because of their beliefs.<br /><br />I recommend this movie for anyone who wishes to understand more about Joseph and the hardships that the pioneers went through. After all, it is apart of American History.",positive,0,0,0,0,0,0,0,0,1,1,1,0,0
"As a casual listener of the Rolling Stones, I thought this might be interesting. Not so, as this film is very 'of its age', in the 1960's. To me (someone born in the 1980's) this just looks to me as hippy purist propaganda crap, but I am sure this film was not made for me, but people who were active during th '60's. I expected drugs galore with th Stones, I was disappointed, it actually showed real life, hard work in the studio, So much so I felt as if I was working with them to get to a conclusion of this god awful film. I have not seen any of the directors other films, but I suspect they follow a similar style of directing, sort of 'amatuerish' which gave a feeling like the TV show Eurotrash, badly directed, tackily put together and lacking in real entertainment value. My only good opinion of this is that I didn't waste money on it, it came free with a Sunday paper.",negative,0,1,0,0,1,0,1,0,0,0,0,0,0
"I cannot believe that the Indian film industry still puts out such third-rate dross as Waqt. For starters, the storyline is totally implausible 聳 spoilt son gets thrown out of family home so as to teach him some self-sufficiency. So what does he do? He promptly goes on to win some national talent contest by doing some star jumps in front of a panel of judges (I honestly am not joking here). In the meantime, his dad is dying of lung cancer, but keeps it a secret from the son, but he survives long enough to see his son become famous, to see his new grandson and also make a new toy giraffe with his own hands.<br /><br />The acting is cringe worthy in its hamminess 聳 no effort was made to try and act in any convincing manner by any of the main players in this film. As usual for Indian films, the family lived in a huge mansion and seemed relatively untouched by the concerns of the real world.<br /><br />To be honest, the main losers when such dire films are made are the intelligent viewers who made the mistake of seeing such a film. The actors, such as Amitabh Bachchan and Akshay Kumar, will still be revered as Gods by those people who have nothing but blind faith in Bollywood.",negative,1,1,0,0,1,0,0,0,0,0,0,0,0
"The next-to-last episode aired of the original Star Trek series is an interesting, sometimes melancholy installment that proves the show was still exploring its characters even at this point in the third season; though flawed, 'All Our Yesterdays' has its moments and overall a moody, compelling feel to it. Kirk, Spock, and McCoy beam down to a planet, assuming they are arriving in the nick of time to save or at least give some warning to whatever populace is there, since the planet's sun is due to explode within hours. But as it turns out, the people there are all too aware of the planet's fate, and using a kind of time travel device, have escaped into the past. Each person has been able to choose the time and place in the past where he or she would like to live at a 'library,' run by an elderly man named Mr. Atoz. Atoz assumes the three men are looking for a past to live in as well, and shows them various periods from which they can choose on viewers. There is some rather forced confusion at the start of the episode, with lines like:<br /><br />McCoy- Where did they go? Atoz- Wherever they wanted to.<br /><br />The misunderstanding could be cleared up rather easily, but for plot purposes, it isn't, and soon Kirk finds himself transported back to a period resembling 18th Century England, while Spock and McCoy are sent to an ice age, 5000 years in the planet's past. From here, the main focus is on Spock and his relationship with a woman exiled to this time by a tyrant as punishment. Spock begins acting increasingly emotional, showing anger toward McCoy and deep affection for Zarabeth, the woman. He eventually realizes that he is reverting back to the primitive emotional state of his ancestors on Vulcan, 5000 years ago. Kirk makes his way back to the library first, and finally convinces Mr. Atoz they don't belong in his planet's history. Spock and McCoy return just before it's too late, leaving Zarabeth behind; the Enterprise beams the three up and speeds away as the sun explodes, destroying the planet. The interaction between Spock and Zarabeth provides this episode's most memorable moments, though Kirk's adventure into the 'English' past is amusing. All in all, a very decent latter-day Star Trek outing.",positive,0,0,0,0,0,0,0,0,1,1,0,0,1
"Val Kilmer... Love or loath him, sometimes he gets under the skin of a character and pulls out a performance that makes you go 'Hey! This guy is a GREAT actor!' He did in the leather pants of Jim in The Doors and he's done it again in the leather underpants of John.<br /><br />Revolving around the fall and fall of uber porn king John Holmes, Kilmer strutts to his knees as we unravel one of the biggest murder mysteries hollywood has never solved for over twenty years, with Holmes the key suspect to a brutal Manson-style slaughter.<br /><br />What Kilmer does so effortlessly is exhude the low-life of the celebrity, the do anything to anyone craving that overwhelms anyone who had it and then lost it. Go see him, you'll know what I mean.",positive,0,0,0,0,0,0,0,1,1,0,0,0,1
"I remember the days in which Kim Basinger was nothing more than a pretty face who adorned movies with typical characters of dumb Blondie,romantic interest or damsel in danger.But,everything changed when she won an Academy Award as Best Supporting Actress for her role in the excellent movie L.A. Confidential,and I think I was not the only one who was surprised by her solid performance.However,after that moment,her career did not follow the ideal path.Sure,the prestige she won thanks to that movie made her to participate on moderately prestigious movies (like People I Know or The Door in the Floor),but we have never seen her again on a substantial character.The movie While She Was Out does nothing to put her on that situation; and it is not only that her character is not too tasty,but also that the movie is really crappy.The screenplay from this movie could not be more hollow and basic.However,Basinger brings some conviction to her character,and that makes this poor movie to win a few points.This movie is full of clich茅s and generic villains.The work of director Susan Montford is truly disastrous for many reasons but mainly,because the movie never gets a good rhythm and tone.The ending from this movie is extremely ridiculous.I do not recommend While She Was Out at all.This film commits the capital sin of being boring.",negative,1,1,0,0,0,0,0,0,0,0,0,0,1
"May I start off by saying that Casey Affleck is a very talented actor and I respect his work very much. I wish he was in more movies that showcased his talent. With this said, Soul Survivors was a very, very bad movie. Very bad.<br /><br />I would have to say that I lay almost all the blame on the poor script. Affleck is a very talented actress, Wes Bentley had an outstanding performance in American Beauty, Melissa Sagemiller did well, and Eliza Dushku is currently the it girl in Hollywood. I don't think any of the actors really got into the script, and I understand why. To say that this movie belongs to the horror genre is an overstatement. It did have the twists and turns you would expect, but they just didn't lead anywhere... except to more confusion. I just found the ending very anti-climatic, because it just didn't seem to make any sense or really answer any of the questions that I had about the storyline.<br /><br />I wish I could give this movie a good review, but I can't. In all honesty, the only thing I think you will find scary about this movie is that you paid for it.",negative,0,1,0,1,0,0,1,0,0,0,0,0,0
"Harold Pinter rewrites Anthony Schaeffer's classic play about a man going to visit the husband of his lover and having it all go sideways. The original film starred Laurence Olivier and Michael Caine. Caine has the Olivier role in this version and he's paired with Jude Law. Here the film is directed by Kenneth Branaugh.<br /><br />The acting is spectacular. Both Caine and Law are gangbusters in their respective roles. I really like the chemistry and the clashing of personalities. It's wonderful and enough of a reason to watch when the script's direction goes haywire.<br /><br />Harold Pinter's dialog is crisp and sharp and often very witty and I understand why he was chosen to rewrite the play (which is updated to make use of surveillance cameras and the like).The problem is that how the script moves the characters around is awful. Michale Caine walks Law through his odd modern house with sliding doors and panels for no really good reason. Conversations happen repeatedly in different locations. I know Pinter has done that in his plays, but in this case it becomes tedious. Why do we need to have the pair go over and over and over the fact that Law is sleeping with Caine's wife? It would be okay if at some point Law said enough we've done this, but he doesn't he acts as if each time is the first time. The script also doesn't move Caine through his manipulation of Law all that well. To begin with he's blindly angry to start so he has no chance to turn around and scare us.(Never mind a late in the game revelation that makes you wonder why he bothered) In the original we never suspected what was up. here we do and while it gives an edge it also somehow feels false since its so clear we are forced to wonder why Law's Milo doesn't see he's being set up. There are a few other instances but to say more would give away too much.<br /><br />Thinking about the film in retrospect I think its a film of missed opportunities and missteps. The opportunities squandered are the chance to have better fireworks between Caine and Law. Missteps in that the choice of a garish setting and odd shifts in plot take away from the creation of a tension and a believable thriller. Instead we get some smart dialog and great performances in a film that doesn't let them be real.<br /><br />despite some great performances and witty dialog this is only a 4 out of 10 because the rest of the script just doesn't work",negative,0,1,0,1,0,0,0,0,0,0,0,0,1
"If your a fan of Airplane type movies this is a must see! Set in the 1920's and 30's Johnny Dangerously has not only great actors but great lines. ""knock down dat wall,knock down dat wall and knock down dat #@$%#@$ wall."" ""You shouldn't hang me on a hook johnny"" or ""Sounds like Johnnys getting laid"". Its definitely a spoof of the old James Cagney Movies and references them a lot. There's a great scene when Jhonnys walking down death row and has a priest set up for his escape. Listen closely to the fake priests readings, its pretty funny. Another great scene is when Dom Delauise plays the Pope. Watch his reaction to Johnny after he tips the Pope, a lot said without making a sound.I recommend this movie to all who love to laugh or are old movie buffs.",positive,0,0,0,0,0,0,0,1,1,1,0,0,0
"Pretty poor Firestarter clone that seems more like a bad TV movie than a bad feature film. How disappointing for this to come from Hooper and Dourif!<br /><br />Government contractors do a human experiment with a Hydrogen bomb. The boy born to the couple from the experiment constantly runs a fever of 100 degrees, and when he's an adult, people in his life start spontaneously combusting. He tries to find out why.<br /><br />The people completely on fire are well done, but when they get to the point that they are well done in another sense, they're obviously changed to dummies. When jets of fire shoot out of characters' arms, it looks silly rather than alarming the way it should. Also ridiculous is fire that evidently travels through phone lines and erupts in huge jets from the receiver's earpiece. How is that supposed to happen, exactly?<br /><br />Something else that struck me as silly about the movie is when a character has visions of his late parents. We later see the exact same shots from those visions in home movies.",negative,1,1,0,1,0,0,0,0,0,0,0,0,0
"***spoilers***spoilers***spoilers***spoilers<br /><br />There are bad movies and then there are movies which are so awful that they become affectionately comical in their ineptness. Such is the case with Columbia Pictures' 'The Grudge.' This cinematic atrocity began when an otherwise well intentioned American saw a Japanese made for TV film 'Ju-on' and was inspired to remake the movie in English. This began a virtual tsunami of bad decisions which circumnavigated the globe until it washed ashore in Orlando on October 21, 2004.<br /><br />The premise, and I use the word loosely, involves a house in Tokyo haunted by a skinny Momma ghost who looks like a cross between Margaret Cho and Alanis Morrisette, along with her ghastly sidekick a chubby, rambunctious but evil second grader. Is there anything scarier than a creepy 8 year old Japanese boy? Sure there is! Count Chocula comes to mind. With this whimsical bunch we must add a mysterious black cat who I have affectionately named Chim Chim. (Remember Speed Racer?) As you have already guessed, they were murdered in this domicile of doom and now desire to kill everyone who enters the premises. You see, as explained by a Japanese detective, when someone dies in a rage their ghost seeks revenge on everyone who steps on the property lines as defined by the county commissioner or something like that, I forget. <br /><br />The story begins innocently enough with acclaimed thespian Bill Pullman leaping to his death from a balcony. My guess is Bill Pullman got this job because of his kids begged him for a trip to Tokyo Disneyland. Next we endure the mildly interesting saga of Nurse Yoko, 'oh no don't go in there' screams the audience, but alas she heeds not the dire warnings and is predictably snuffed out like a magic lantern. About 30 minutes into the movie we finally see its American heroine Sarah Michelle Gellar as Karen. Sarah Michelle Gellar might be a competent actress but I could not help thinking of Buffy the Vampire Slayer, so much so that it was distracting. It is the equivalent to having Jennifer Anniston star in a movie about the adventures of six friends in New York. Try as you may, you just can't stop thinking about the other project which made her famous. But I digress, Karen, the nurse is hired as a replacement for the original care giver who disappeared at spooks r us. <br /><br />She snoops around, meets the ghosts, coma lady dies, and some other stuff happens. Watching the fair haired vixen searching for clues I half expected her to find the ghost and pull its mask off to reveal it was actually old man Gower who owned the abandoned amusement park! 'I would've gotten away with it too if it weren't for you meddling kids and that dog of yours!' <br /><br />Director Takashi Shimizu, who is vying to be the Ed Wood of Asia, made two unfortunate decisions involving sound. First, he choose to use a soundtrack only when someone is about to be killed. This is an excellent devise for obliterating any suspense because the audience gets a two minute warning to prepare for another miserably predictable murder. Second, he gave the ghosts a bizarre guttural noise that sounds like a gargling gopher. After the movie, I heard several people exiting the theatre making the sound and laughing.<br /><br />Sarah Michelle Gellar ends up being the sole survivor. And of course we learn that the fire she set to burn down the house was extinguished in time for the obligatory next chapter. However, considering the humorous reactions of the audience, they did not want a sequel but an apology. 'The Grudge' could be easily re-edited into a comedy, perhaps then it will be appreciated for its camp value. Baring that, this will go down as the greatest cinematic thriller since 'Godzilla vs. Megalon.' I would suggest waiting until the movie comes to your local discount theatre where it can receive the public ridicule it so richly deserves.",negative,1,1,0,0,1,0,0,0,0,0,0,0,0
"Working with one of the best Shakespeare sources, this film manages to be creditable to it's source, whilst still appealing to a wider audience.<br /><br />Branagh steals the film from under Fishburne's nose, and there's a talented cast on good form.",negative,0,0,0,0,0,0,0,0,1,1,0,0,0
"Final Score...who cares - it's a reality show. It has no love for it's audience, it panders to lazy TV viewers, puts nothing in and gets nothing out.<br /><br />""Joe Millionaire"", the most blatantly phony reality show of them all, is a television disaster of epic proportions. It's a watershed, rock bottom moment, not only for Fox, but for the American viewing public who actually watch, like and talked about this crap the next day. You people ought to be ashamed of yourselves. Because as much as Fox promotes this junk it won't make any money unless it's watch by people (and boy was it, the finale got nearly Super Bowl numbers!?). It doesn't bother you people that there are many quality shows written, directed, acted and generally have effort put into them that are being cancelled while you sit back and lap up this effortless, cold game show?<br /><br />I used to be a staunch supporter of Fox. It's those of us like me who like and seek out quality TV that helped build Fox back in the days of Married...with Children and The Simpsons. Conveniently enough, now neither of those shows would make it 6 weeks with the current management. The Gail Berman ""reign of terror"" as it's often called. The network has waged war on scripted TV AND, strangely enough, it's fans. The very people who helped build them in the beginning. Now, not only do we have to fight for good shows, but we have to fight against their own network. It boggles the mind. Nothing Fox, has done in the past 3 years makes any sense. From canceling hits like ""Titus"", ""Futurama"" and ""John Doe"" (NBC can renew ""Boomtown"", but Fox can't lift it's pitiful head to give the only decent show they had this season another shot?). And the reason they can do all this: the success of junk like ""Joe Millionaire"". They can now say ""We don't need you TV fans, we have reality shows"". They apparently seem to have no idea that the big audience the draw with this junk is fickle and WILL abandon them the second the next fad comes along. To alienate their base like this will eventually kill the network the way it has set back ABC.<br /><br />The show itself is a joke. Here we have a premise, in the now classic Fox gimmick, that promises us something different and edgy, but then delivers something not in any way different from ""The Bachelor"" or anything on the big 3. Fox has gone mainstream. The finale and ""twist"" (quote/unquote) showed they have no ideas up their sleeve. Now we know that all these shows, no matter how different they look, will all end up the same cornball, fairy tale ending. We got to see a bunch of lame aspiring actors that the network picked out of millions of head-shots to fit their demographics parade around like high school bimbos pretending they liked this Evan Marriott because...well because it was a competition and that's what you're supposed to do. Marriott himself is like a hideously disfigured Chro-magnum man who struggles to put together the simplest sentences. But, how can the women (all average to ugly looking by the way - an important minus is a guilty pleasure show like this) not fall for ""Joe"" with such charming lines like ""Look, you're not stupid"".<br /><br />I used to think that people who watched these reality/dating/game shows were just to lazy to change the channel, but after ""Joe Millionaire"" I think they must be genuinely mentally deficient. Come on people, have a little more pride in yourselves. Demand a little bit more from your entertainment then THIS.<br /><br />Boycott FOX.",negative,1,0,0,0,1,0,0,0,0,0,0,0,1
"I was expecting a movie similar to Deuce Bigalow, which I enjoyed. However, this dud seemed to last forever. It's one of those flicks which enjoys the sad placement of PG-13 while not being kid appropriate. The jokes aren't just low-brow or f**t jokes, they're crude, lewd, and many acts cross the boundaries to not only bad taste but beyond legal and moral decency. Many scenes appear to have been chopped to get the PG-13 rating...too bad...it might have made a bigger splash as an R-rated film if the funny was left in. (Overstatement? Probably.) I do not recommend this movie. It is a full-on waste of time...and I'm a movie lover and ready to give just about anything a shot. At 45 minutes in, the movie felt like it should be winding down...and boy were we ready for it to. The ending is quaint but doesn't salvage the rest of this quagmire/tourist trap of a rental. 1/2 star (glad I saw it as a freebie...would have been sickened to pay hard-earned greenbacks for this tripe)",negative,1,1,0,0,1,0,0,0,0,0,0,0,0
"Woman with wig, who ""dyes"" her hair in the middle of the film (=takes of wig) presumably does not see what the audience can see from miles away:<br /><br />*** begin spoiler alert *** that her hubby is having an affair with her best girlfriend and they both try get rid of her. *** end of spoiler alert ***<br /><br />And what a spoiler that was: the title already gives it away, doesn't it? Bad acting, bad script: waste of time Oh yeah: in the end, she lives happily ever after....<br /><br />If you liked this movie, you'll really love ""Cannibal women in the Avocado Jungle of Death""....",negative,1,1,0,0,0,0,0,0,0,0,0,0,0
