Review,Classification,Disgust,Disappointment,Sadness,Confusion,Anger,Fear,Indifference,Surprise,Interest,Happiness,Touched,Motivation,Reflective
"Before Sunrise is romance for the slacker generation. Richard Linklater's romantic drama is an offbeat telling of a dream come true for most people. The film depicts romance in all it's glory, but without any of the pitfalls that befall most couples; and in short the film is about two people that have a relationship that's as close to perfection as relationships will ever come to - with just one problem, the problem of time. While most relationships wind down with time, this one keeps going strong throughout and time itself is the only thing that wears out. Before Sunrise is certainly not the typical sentimental 'Hollywood romance', which is another aspect that puts this film leagues ahead of the pretenders. The story follows two people, Jesse; an American and Celine; a French girl that meet on a train into Vienna. They instantly connect, and after telling her his awful idea for a television show and almost getting off the train, Jesse asks Celine to join him for the day in the picturesque city of Vienna...<br /><br />Before Sunrise works principally for two reasons - realistic acting and an immense script that builds the characters through their thoughts and feelings and thus allows us to get to know them as we do the people in real life. This allows the characters to be free, and it's easy to believe that these are real people and not just actors working from a script. This also allows us to feel for the characters for who they are, and not merely because they're the protagonists. This kind of realism is hard to capture as, at the end of the day, we as the audience know that they're watching a film and not observing real life; but Before Sunrise represents one of the truest to life exhibitions of realism ever to be seen on screen. A truly great script cannot work on it's own, and needs great actors to deliver it to an extent that does it justice, and although I'm not a fan of either Julie Deply or Ethan Hawke; on viewing this film, there is nothing you can do but give them both respect. I don't know whether they were in character or just playing themselves, but when a film is this good; it hardly matters.<br /><br />In a film like this, it is the writing that's the most important thing, and contained within the script are several observations about life, most of which I personally could relate to. This represents what Richard Linklater has achieved with this script as not only does it create and build the characters, but it also manages to expose what true love is, along with several other aspects of life. The fact that not all the anecdotes are relatable to me personally again represents the brilliance of writing. Everyone is different, and so different parts of the script will appeal to different people. There could be certain aspects about one person that one person loves and another hates; and that's the case with the musings in this script. Adding to the beauty of the film is the city of Vienna. The city itself isn't really important to the film as this is a story that could have taken place just about anywhere - but it makes for some lovely visuals and the upbeat, energetic romance that blossoms throughout the movie is matched by the beauty of the location.<br /><br />Before Sunrise is simultaneously beautiful and captivating. Richard Linklater has created something that is rare in the world of cinema; a film that captures the beauty of life without ever going over the top or being overly sentimental. Before Sunrise is what it is. And what it is, is pure cinematic brilliance.",positive,0,0,0,0,0,0,0,0,0,1,1,1,0
"Embarrassingly, I just watched this movie for the first time, 13 years after its release. It's a story that any father or brother can relate to... one brother is a bit 'wild,' the other brother is the typical older child. Craig Sheffer is a little too unemotional as the oldest brother, but Pitt is amazing, and Skerritt is perfectly cast as the father. The fishing scenes that were filmed in Montana are absolutely breathtaking... I had no idea that fly fishing could be so attractive. The movie closely follows the book, with only a few modifications to make it more appropriate for a movie format. Unlike most book to movie stories, this one measures up. It's a perfect movie for anyone who wants a quiet night with a powerful and somewhat emotional movie.",positive,0,0,0,0,0,0,0,0,0,1,0,0,1
"It really doesn't matter that Superman comic books are unbelievably naive and their target is ten year old. What matters is that ""Superman Returns"" is bad movie. <br /><br />In the beginning,a question for You Dear Readers, how many of You actually believe that Superman will be defeated by bald Kevin Spacey? Anyone? Just as I thought. No spoilers here. So let's get to some major issues right now.<br /><br />Firstly, this movie looks like commercial (scene in the bar with Superman/Clark Kent drinking Budweiser is only scene which looks as it supposed to). Imagine commercial of Superman, two and half hour long. Let's be serious this isn't ""Amadeus"" or ""The Departed"". You actually feel, that this movie is way too long. And special effects are not so special by the way.<br /><br />Secondly, scenario is silly. Sometimes even if something is acceptable in comic, in cinema it looks just stupid. And it's like that in this case. Of course dialogs are disgrace. I can't believe somebody took money to write them. How many times we will be fed with villain making speeches? How many times laws of physics will be raped? (Jesus, it's not only the matter of Superman's strength but also a resistance of materials his dealing with.) How many times Lois Lane will be fooled by Kent? How many times Hollywood producers will seek for a story in a trashy comic books? Since there's hard to make a good story, why having a weak story for a starter? It just doesn't work. Guys, get a grip. Try harder, please. Or just stay on this strike forever, who cares. I got the feeling that WGA is permanently on strike. No offense. I'm not questioning the lame money those people are paid, but the quality of the product they deliver. In this case there is no quality at all. (At this point You may ask yourself: is it that bad? Yes it is.)<br /><br />Thirdly, acting is weak, which is quite a surprise since Bryan Singer (Usual Suspects) is directing. Kevin Spacey is having fun, but he's the only one. Audience is rather not in the mood for jokes. Thing is that comic book hero can be developed into real personality, with clear motivations but also with doubts, fears, some depth. In this case nobody did that job, and characters aren't really interesting.<br /><br />Finally, whole effort of creators turns this movie into parody. Second unit is so bad that attracts attention, since there's nothing interesting going on on screen anyway. The harder they try (if they try), the funnier it gets (but it isn't laugh You could expect).<br /><br />Final conclusion? One word: shame. <br /><br />This particular movie, ladies and gents, is camp. Don't waste Your time and don't waste Your money too. Stay home, read a book.",negative,1,1,1,0,1,0,0,0,0,0,0,0,0
"Jean Seberg had not one iota of acting talent. Like all her films, 'Bonjour tristesse' suffers not at all from her looks (though she is perhaps the first of those modern women whom Tom Wolfe gleefully, accurately describes as ""boys with breasts"": publicists, of course, use the word ""gamine"") but suffers grievously from Seberg's dull, monotonous, killing voice. In all her films when had to play anger, Seberg played it with grossly audible, distracting, gasping panting between her monotonously droned verbalizations. Oy.<br /><br />Preminger's adaptation of Fran莽oise Sagan's breathlessly juvenile, fantasy soap opera plot is noteworthy only for his lush cinematography - but then that's difficult to funk on the photogenic French Riviera, and perhaps for his apt, but certainly not groundbreaking, employment of black & white for the present day scenes from which Seberg's monotone narration delivers us to the flashed-back-to color past.<br /><br />Juliette Gr茅co has a brief moment, as a nightclub chanteuse in the black & white spotlight, delivering in smoky Dietrichesque voice the bleak existentialist lyric of the title song. This moment is nowadays, in retrospect, more than a wee bit dr么le. Except, of course, if you're French - particularly if you're a French ""68-er"" longing for the glorious days of the barricades roundabout the Sorbonne - and your kids riot to retain the lifelong sinecures which have blighted and emasculated France's economy: then you still believe in Sartre and Foucault and all such arcane, irrelevant theorists.<br /><br />David Niven has the hardest role, having to play with sufficient gusto an aging hedonist who's yet to grasp that life isn't all about Sagan's teenybopper notions of a hip, cool, swingin', ""mon copain!"" Papa. Deborah Kerr delivers her usual, consummately professional presence, convincingly playing the woman who suffers undeservedly Seberg's spiteful teenaged snot-nose jealousy (fulfilling Sagan's shallow teen fantasy of the Classical theme of ""there can be only one Queen Bee in the hive""); in fact, to Kerr belongs this film's sole great and memorable on-screen moment.<br /><br />The dialogue is unnatural - I agree with an earlier reviewer who said that it sounds to be ""badly translated"" from French; combine the unnatural scripting with Seberg's incomparably dull, unendurable monotone and you can save that Valium for another night. Atop all that the ineptly synched post-production voice dubbing is, almost throughout, obvious and thus much more than irksome: this is especially true of the dubbing for Myl猫ne Demongeot because it spoils her otherwise very pleasing dumb blonde performance.<br /><br />Hunky Geoffrey Horne gets the short end of the stick here - a very good looking young man who also suffered from a less-than-lovely, uncinematic voice which, when paired with Seberg's drone, yields unconvincing scenes of puppy love. (Horne was, shall we say, merely adequate in 'Bridge On the River Kwai,' perhaps because his end was held up by those great cinema pros William Holden and Jack Hawkins instead of being unsupported by the regrettably ungifted Seberg).<br /><br />In sum 'Bonjour tristesse' is pretty to look at but it's shallow, immature soap: thin gruel with suds.",negative,1,1,0,1,0,0,0,0,0,0,0,0,0
"This is not as funny and gory as the DVD box claims. I really love twisted and wierd movies, but this one is really just dull! It's one hour of ripped off penises, flying Baby Born dolls and a lot of rape! I think the intention with this amateur sleaze, was to make a It's-so-bad-it's-good movies, but it fails. It's just bad! A few scenes are ok, but in whole it's a mess. If you like amateur splatter like this one (Only way better) I would recommend Andreas Schnass' Violent Shit 2 and 3.",negative,1,0,1,0,0,0,0,0,0,0,0,0,0
"Paul (Jason Lee) is an underachiever who just happens to be engaged to a type-A princess named Karen (Selma Blair). She chooses his clothes and his daily schedule. At his bachelor party, Paul gets a little too drunk and somehow ends up taking a pretty dancer named Becky (Julia Stiles) back to his digs. ""Nothing happened"", as they say, but the duo do wake up in the same bed. Suddenly Karen telephones. She's on her way to Paul's apartment. Understandably, Paul hustles Becky out of the place, although her underpants are left behind. But, there is even more fun ahead. At a family dinner at Karen's parents' home, Paul runs smack into Becky again, learning that she is Karen's cousin. Talk about some explaining to do! But, instead, Paul chooses to feign a stomach problem and hides out in the bathroom. Will Karen ever find out that Becky spent the night at Paul's place? And, what will be the consequences? I'm sorry for critics who pan movies like this. They should definitely lighten up, for this film is fresh and fun. Of course, it doesn't hurt matters that Lee is a consummate funny man, Stiles is a charming beauty or that Blair is a natural as a pretty but anal fianc茅e. The rest of the cast, including James Brolin and Julie Haggerty, is also quite nice. The look of the film is wonderful, as are the costumes and California settings. Best of all, the script is imaginative and inspired, creating big laughs for the audience. In short, if you want to tickle the proverbial funnybones, get this movie tonight. It may not be Academy Award material but it is absolutely guaranteed to turn a bad day into a darn good one.",positive,0,0,0,0,0,0,0,0,1,0,0,0,0
"Me and my girlfriend, Annette, watched this together and we'll both comment.<br /><br />Both of us really enjoyed watching this even though it took some liberties with Dicken's work. A lot of Dicken's works are somewhat dark and dreary (including Oliver Twist), but this movie changed all that. It was fun, colourful (both visually and musically), and the characters were more lighthearted.<br /><br />TRAVIS: Normally, I don't care a lot for musical and dance movies, but the tunes in this production were catchy and lively, and the choreography was awesome.<br /><br />ANNETTE: That's really saying a lot coming from Travis. I can't emphasise enough how really good the dance numbers were. You can tell, for example, that those boys really worked hard getting the routines down to perfection.<br /><br />TRAVIS: Three actors really stood out IMO; Nancy (Shani W.), Bill Sykes (Oliver Reed), and Artful Dodger (Jack Wild). Man, that Oliver Reed can really do a good villain. That one scene where you see his eyes thru the mail slot gave me chills down the back...AWESOME. And that kid Jack Wild was a perfect Artful Dodger. And Nancy was fantastic (man, I felt bad when she got killed). She can sing too! Kudos to the casting department on their choices there. I hated the Oliver Twist kid tho. He was just too whiny and wimpy for my taste. (I kept wishing Bill Sikes would drop him off into the mud during the chase scene.) And they shouldn't have had him sing either.<br /><br />ANNETTE: Acting was truly superb. In addition to the three stars Travis mentioned, I felt Ron Moody (Fagin) did a tremendous job. He was so funny, and at the same time lightly sinister too. The supporting actors were great too. Harry Secombe carried his Mr. Bumble role extremely well. And he has a wonderful singing voice. I saw Mr. Secombe perform in another movie entitled ""Davy"" where he played an opera singer with pleasing results. The talented Harry Secombe should have been in a lot more movies.<br /><br />TRAVIS: As I mentioned earlier the story isn't quite true to the book, but IMO it was more robust. This movie was not boring either, as some musicals seem to be. And the continuity kept you moving right along with the characters. The tunes did not detract from the plot or put you to sleep by being too long.<br /><br />ANNETTE: Any musical movie which Travis watches completely has to be a rare find. And this one is indeed a rare find. It is a very easy-to-watch production which carries the viewer smoothly and enjoyably through to the end. In a day when movies all seem to be effects combined with pretty faces, this was a refreshing interlude.<br /><br />Our combined rating for this was 8.5 of 10. (We'll round up to 9 in this case.).<br /><br />TRAVIS: I rated this a 7 mainly because the Oliver Twist kid (Mark L.) irritated me, and his songs were torture to my overly sensitive ears. Otherwise, it was an outstanding movie.<br /><br />ANNETTE: My rating is a 10. Movies don't get much better than this. And you can tell everyone involved in this production really worked hard to make it what it was...a masterpiece.<br /><br />Please don't miss this one...even if you normally don't like musicals. It really is a rare treat.",positive,0,0,0,0,0,0,0,0,1,1,0,0,0
"I don't really know whether Cabin Fever is supposed to be a joke or a film... But as far as I know, it's much closer to being a joke than anything else. A few years ago, the community of horror film makers decided to take a new step and make fun of the genre, thus giving birth to the Scream series. A list was given in Scream, of all the stupid things horror film characters will do that are predictable, and the characters in Scream ended up doing exactly the same things, which added a lot of humor and irony to this analysis of the genre, and led to hope that horror films from now on would show a bit different, either full of irony towards the genre, self-derision towards the film itself, or at least different in their dramatic process than all the ""old"" films that responded to the same tired criteria. In seeing ""Cabin Fever"", alas, many will see how unoriginal, serious, pretentious, boring and even not scary some supposedly ""scary"" films are now, even a few years later. First of all, this film lacks originality in a way few others do. It has been said several times, how little imagination horror directors have today, remaking remakes of foreign sequels, but setting the film in a cabin in the woods just doesn't seem to be an ""hommage"" to anything, it seems to be, simply, a ripoff. Whoever wishes to be surprised by other factors of the film's story won't be: once again, we are dealing with a film whose characters are all in their early twenties, who won't think rationally when placed in front of a problem, will rather argue for hours and pick up fights than try to think and do something about it. Not much excitement there either. For the umpteenth time in a horror film, they are tempted to kiss, make love and just basically have fun, all sorts of things that don't really make them any different than any other horror film victims seen previously. Secondly, this film is unimaginatively serious. Every situation the characters are in, every dialog, every situation in the film is treated with such seriousness that any viewer with a little sense of derision will be relieved when some characters finally end up dying. Nothing in the way the film is directed, written or acted shows any sign of humor or sarcasm, which is quite amazing considering the film is about an invisible-never-heard-of-before-flesh-eating-virus (no laughs please). I won't even bring up the acting, since there are no actors in this film. The cast was most certainly hired for being friends or neighbors with the director. Thirdly, and this will strike whoever has seen a ""good"" horror film before, the screenplay is absolutely empty. Nothing really happens, some actions are repeated several times (""let's try to get help!""), nothing makes sense, either in the facts, the psychology of the characters, or even the hilariously lame last sequence of the film, which is probably supposed to be funny according to the director and screenwriters. In the end I will only remark that a horror film is supposed to have something scary in it. Gallons of fake blood, whether they are being vomited, squirted from severed limbs or simply dripping from wounds, never were enough to scare an audience. Such major features as screenplay, ideas, and even cruelty are requested for whoever claims to have shot something scary. If I wasn't considering it to be a total failure, I would agree to reckon that the film has one talent: it is filthy disgusting to watch. Yet being grossed-out and being scared are two very different feelings, let it be known.<br /><br />I would like to encourage anyone a tad curious or interested in seeing this film to check older major horror films first, why not from the 60s, the 70s, the 80s, films made by Wes Craven, Dario Argento, Sam Raimi, Stanley Kubrick, David Lynch, Roger Corman, William Lustig, John Carpenter... it might not only give a good definition of what is scary, or self-derisory horror, but also convince viewers that ""new"" isn't necessarily ""better"". A good example related to the film is the few tracks composer Angelo Badalamenti provided for this film, even although they are unmistakably close to his previous compositions, they are below anything he has ever done before.",negative,1,1,1,0,0,0,0,0,0,0,0,0,0
"Just a warning... This is the worst movie I have seen in years... I couldn't watch it to the end... It is a pure waste of time... I really feel sorry for Snipes that he ended up in such a movie. There really is not much to say about it. Horrible acting, incredibly bad lines, story, everything. The only reason I would advise you to watch this movie is if you really want to see how a movie shouldn't be. Just to tell you one scene: the police are searching for Snipes, and they are surrounding the building with helicopters and cars, they are shooting around inside the building, but still they are whispering so that Snipes doesn't suspect a thing.",negative,1,1,1,1,0,0,0,0,0,0,0,0,0
"There are no spoilers in this review because everything was already shown in the movie's trailer. I am trying to be balanced in my review because I strongly support local movies, but I can't help but support the backlash against this movie. It is slow, boring and bordering on pointless. Even the ""almost nice and believable moments"" were immediately undercut by painful clich茅s and bad acting. Vernetta Lopez and Wong Li Lin, whom I usually love, were only passable in this movie. It felt like the director was trying to make a melodramatic TV Soap, then got carried away and decided to put it on the big screen. The Leap Years should come with an RA rating (Rated Awful) but it hasn't changed my faith in local movies. More good films will come, so long as more films like these don't get made.",negative,1,1,1,1,0,0,0,0,0,0,0,0,0
"Revolt of the Zombies is BAD. There is nothing remotely entertaining about the movie. It is dull, lifeless, poorly acted, and poorly scripted. I've often complained that the original Dracula is a little slow for my taste, well this movie makes Dracula look like a roller coaster ride. The 65 minute running time seemed like 165 minutes.<br /><br />The story: An expedition is sent to Cambodia to find the secrets of mind control through ""zombification"". One man finds the secret and uses it to make the woman he loves marry him. Once this happens, he releases the zombies under his control to horrific consequences. That's it. That's the whole story.<br /><br />For most of the movie, I was trying to figure out where I had seen the male lead. He looked so familiar. I had plenty of time to think this over. Nothing was happening in the movie. Just before the ""zombies revolted"", it hit me. It was Dean Jagger. I had seen him recently as the General in White Christmas. This is how I ""entertained"" myself throughout most of the movie.<br /><br />I'm just glad I didn't buy the DVD for this movie. King of the Zombies is on the other side and it's a masterpiece of film making compared with this movie. For what it's worth, I'll give it a 2/10. (I won't go to 1/10 because, believe it or not, I've seen worse.)",negative,1,1,1,0,0,0,0,0,0,0,0,0,0
"If you are a fan of really bad movies, and you think there funny, you will the great acting of Shaq. First off putting pro players in movies hardly ever works. Shaq had to of been the worst actor i have ever seen next to Dennis Rodman who also made a few bad movies. Well any way this movie is also bad due to the hideous kid. I would give this a zero but that is impossible.",negative,1,1,0,0,1,0,0,0,0,0,0,0,0
"I've really enjoyed this adaptation of ""Emma"".I have seen it many times and am always looking forward to seeing it again.Though it only lasts 107 minutes, most of the novel plot and sub-plots were developed in a satisfactory way. All the characters are well-portrayed. Most of the dialogues come directly from the novel with no silly jokes added as in Emma Thompson's Sense and Sensibility.<br /><br />As a foreigner, I particularly appreciate the perfect diction of the actors. The setting and costumes were beautiful. I find this version quite on a par with the 1995 miniseries ""Pride and Prejudice"" but then the producer and screenwriter were the same. Kate Beckinsale did a really good job portraying ""Emma"" of whom Jane Austen said she would create a heroin no-one but her would love. She is snobbish but has just enough youth and inexperience to be still likable. Mark Strong was also very good at portraying Mr Knightley, not an easy part, I think, though he has not the charisma shown by Colin Firth's Mr Darcy in Pride and Prejudice. Even the end scene (the harvest festival) which does not happen in the novel provides a fitting end except for when it shows Emma being cold and almost unpleasant with Frank Churchill whereas in the novel she was thoroughly reconciled with him, even telling him that she would have enjoyed the duplicity, had she been in his situation. A strange departure from the faithfulness otherwise shown throughout the film. I find the costumes more beautiful and elaborate than in other adaptations from Jane Austen's novels.",positive,0,0,0,0,0,0,0,0,1,1,0,0,0
