Review,Classification,Disgust,Disappointment,Sadness,Confusion,Anger,Fear,Indifference,Surprise,Interest,Happiness,Touched,Motivation,Reflective
"I was dying to see this once I saw the ridiculous MEATBALLS poster and divined that it had to be the best satire ever. What a brilliant idea for a satire--the genre is rife. Unfortunately, the finished product (as I think all involved probably realize) is a catalogue of missed opportunities, not-quite-there performances and (thankfully!) a few extremely hilarious, inspired bits. Janeane Garafolo, who is very striking, looks really bad here, probably because she is uncomfortably struggling to make her flat role funny. David Hyde Pierce is just sad to watch, trying to hard to be funny and looking like a Castro nerd. Molly Shannon is so funny just SEEING her makes you laugh, but somehow her segment fails to snowball into something hysterical. Paul Rudd had great teen mannerisms and was sexy as hell, the other guys are also really funny (the nerdier ones). I think the problem is the director just doesn't move things along at the right pace. He starts out very deadpan, and that sets the monotone. But when he lets things get really outrageous (the drug sequence is the second funniest moment I've had all year in movies, the first also coming in a lame movie: Andrea Martin in ALL OVER THE GUY complaining about the movie IN & OUT), it's just plain funny. I wanted this movie to work so badly, but it just didn't. The clothes and styling for 1981 are 99.9% PERFECT, and the very few songs used are also perfect. This ends up as a medium-bad MAD TV episode, complete with frustratingly overlong sketches.",negative,0,1,1,1,0,0,1,0,0,0,0,0,0
"The movie is basically the story of a Russian prostitute's return to her home village for the funeral of a sister/friend. There are a couple of other minor story lines that might actually be more interesting than the one taken, but they are not fully explored. The core of the movie is the funeral, wake, and later controversy over the future of a community of crones that make dolls and sell them to buy vodka but are now missing the artist who made their dolls marketable. Apparently, the movie is unedited. The prostitute's journey from the city to the village is an excruciatingly endless train ride and tramp through the mud. Maybe that's supposed to impress us with the immensity of the Russian landscape. The village itself, such as it is, is inhabited by a legion of widows and one male, the consort of the dead girl. Continuing the doll business is problematic for everyone involved and eventually seems impossible. Most of the film is shot with a hand-held camera that could induce nausea. Another problem for Western viewers is that subtitles don't include the songs and laments of the crones. Don't go to this movie unless you're fluent in Russian.",negative,0,1,1,0,0,0,1,0,0,0,0,0,1
"I thought that I was never going to find a horror movie as bad as ""The Return of the Texas Chainsaw Massacre"", but this film compete with it.<br /><br />I麓m not a person that get asleep when watching a movie, but I did it 15 minutes after the Trance started. I woke up, and started to watching it agian. Why did I deserve that? All the movie was a torture, I have to use fast forward to watch it complete.<br /><br />I can麓t stand why one of my favourites actors of all time (MR. WALKEN) could done this thing. I have to think that he made the director a favor, or he was really in the need of money, because film after film he is doing, he is ruining himself; and so fast...<br /><br />What about the movie? it麓s not scary, stupid plot, characters are awful (but I really liked the one played by Jared Harris), effects are very poor, lack of deaths & blood, etc; in three words, it has anything. And I mean it. Can麓t stand how a director can make a film like this.<br /><br />Anyway, When I got more disappointed was when I saw in the video cover, that the film was presented by ""Stephen King"", I think he could never present this crap, no? (I rented it in Argentina). I not recommend it in a million years.<br /><br />I rate this movie with a 2 out of 10. (As I say in my ""Return of the Texas Chainsaw Massacre"" review, there will be always a worse movies, thats why it don麓t deserves a 1 out of 10)",negative,0,1,0,0,1,0,1,0,0,0,0,0,0
"....after 16 years Tim Burton finally disappoints me!!!! Whatever happened to the old Burton who read ""The Dark Knight Returns"" by Frank Miller as research for his preparation to direct Batman back in 1988-89? By the looks of it Burton didn't research the book nor the movie cause he got everything WRONG! This movie sucks! It's not as good as the original and it doesn't deal with the same subject as the original. If you want a good ape movie watch the original.<br /><br />**out of****stars",positive,0,1,0,0,1,0,0,0,0,0,0,0,0
"This movie is proof that film noire is an enduring style, and extremely worthy of stay alive. For me, it is he best example of film noire since Chinatown.<br /><br />It will, unfortunately, never get the recognition it deserves. It was never promoted properly when it was first released and has had to build its cadre of fans through venues like Vanguard Cinema and word of mouth rental referrals.<br /><br />I highly recommend that people looking for something more than mindless entertainment rent this movie and delved into its highly convoluted plot.",positive,0,0,0,0,0,0,0,0,1,0,0,0,1
"This is a truly remarkable piece of cinematic achievement. From the very start I was utterly hooked into the (true) story when Lt. Viktor Burakov (Stephan Rea) weeps while performing the autopsies on the remains of the children's bodies. This then is the compelling story of Andrei Chikatilo, wonderfully played by Jeffrey DeMunn (The Green Mile). In fact, he plays it so well and so sympathetically that the viewer almost starts to pity him, until we remember what he is. The psychiatrist Dr. Alexandr Bukhanovsky, wonderfully played by Max Von Sydow was utterly believable in every detail, and the point he makes when talking about paranoia in the Soviet Union, is made all too apparent by the behaviour of the local Communist Commissar Bondarchuk played by Joss Ackland. For me though, the outstanding performance was from Donald Sutherland, proving once again what a superb character actor he really is. I was almost in tears when he told Burakov how the FBI had so closely followed and admired his work. This film puts Silence of the Lambs into the shade, from the atmospheric and bleak Soviet landscape, to the superlative performances by everyone involved. <br /><br />I rate this film 10/10",positive,0,0,0,0,0,0,0,0,1,0,1,0,0
"I caught this at a screening at the Sundance Film Festival and was in Awe over the absolute power this film has. It is an examination of the psychological effects on our brave soldiers who join the military with hopes that they will protect and serve our country with honor as well as be taken care of by our government for it. The film details the psychological changes that takes place in boot camp as the soldiers are turned into ""killers for their country"" and put into the war and the after effects once they return home. It also portrays the effect that killing has on the human psyche. It pays homage to the Soldiers and never ever criticizes the soldiers unlike other films, instead criticizes a system that is not prepared to and does not take care of all the physical and psychological needs of the returned Vets.<br /><br />This film is powerful, moving, emotional and thought provoking. It stands as a call to arms to support our troops not only by buying stickers and going to parades but by actually listening to them, and helping to support a change in the way their health and well being is taken care of after the killing ends.<br /><br />The best film of the Festival so far, ****/****",positive,0,0,0,0,0,0,0,0,1,0,0,1,1
"It was a good story, but not very well told. I liked the themes and the main story line, which wasn't as clear as it could have been. Maybe there was too much going on and a lack of ability to reign it all in. The acting was okay to cheesy, some were stronger than others and even the stronger actors had their moments of lesser quality acting. It took me a couple of months to get through the entire movie because it didn't keep my attention and the flow was just bad. I only just finished watching it and I'm glad I did as the movie finally gets moving and has some continuity toward the end. Again, a good story, but the delivery was sub par. Would recommend it for the story line and maybe a little eye candy, and I do mean, a little.",negative,0,1,0,0,0,0,1,0,0,0,0,0,0
"I'm a big fan of movies that make you think. I'm still thinking long and hard about this one, fully seven minutes after the credits have rolled. What's really confounding my neurons is the attempt to fathom the relevance to the plot of the naked girlie fondling her slick oily body, made extra-tacky by being filmed on cheap video. This happens three times and I was certain it would be explained in the end. I put my trust in the film-makers that this lurid attempt to lure viewers would be justified. It was not.<br /><br />The movie has to be the most apathetic I've come across in the genre. The sets look like a cross between a 1970s Dr Who set and someone's ill-formed idea of a sponge-painted living room. The lighting is unimaginative (if your sets are going to be that bad, at least film them in semi-darkness to hide the plasterboard and create some ambiance). Of the abducted quartet, the girl stands out as being particularly lame, but none of them is given a personality. The aliens' plans for world domination are just plain silly - all they need is a birth control pill and their problems are solved. Most of the movie consists of people running down corridors. Yes, it really is that exciting. The ""ray gun"" special effect is ... curious, to say the least (what use is a weapon that takes a 15-second concentrated blast to kill, and even then the guy comes back for more?). The script is like a bad episode of The A-Team, and the ladies' hairstyles come from the same era, so they look like school teachers instead of an advance team of murderous alien invaders. When we finally get to see what the aliens really look like, they're in suspended animation and never even get out of their boxes. The resolution of the story - traitor alien simply has a few words with invading fleet commander and without a second thought he heads home - is truly the sign of a writer who's never had an idea more complex than a Saturday morning cartoon (I mean the bad ones with no plot, action, or characterization) in his or her life.<br /><br />But seriously, what is with the naked chick?! Was it really just so they could justify putting flesh on the DVD cover to boost sales?",negative,1,1,0,1,0,0,0,0,0,0,0,0,0
"Saw this piece of work at a film fest in CA. My god, what was the director thinking? Film professors should use this film as a case study on what NOT to do when making a short film. First off, this project makes absolutely no sense whatsoever. The film takes place partially in ""The Waystation"", some stupid vapid bar in the middle of nowhere, where nothing really takes place.<br /><br />THe acting is beyond bad. So bad in fact that I almost thought it was a comedy. The lead actress Julia Reading is a step below the acting in most amateur porn films. There is one or two decent performances, including the guys who played Jacob and Fenner but it's like the director had no clue on how to work or use his thespians. The only thing worse than the acting was the dialogue, which bordered on absurd. The writer (whom I assume is also the director) writes each character like they are auditioning for a comic book villain.<br /><br />The overall production value is pretty good, but to be honest, with a film this bad it's easy to overlook it. The production design is pretty good, although the Waystation looks like any ordinary bar. The costumes and make-up are okay, and I understand the production was working with a low budget. It's just when the characters speak, or they try and push the plot forward, the film unravels into a muck of crap.<br /><br />As I've said, this film is god awful. It's like the director/writer watched a lot of sci-fi films and threw all the parts he liked into a blender and came up with this. My only hope is that he used other people's money on this, because if he used his own, he's a total sucker.",negative,1,1,0,1,1,0,0,0,0,0,0,0,0
"STAR RATING: ***** Saturday Night **** Friday Night *** Friday Morning ** Sunday Night * Monday Morning <br /><br />Ray (Ray Winstone) has a criminal past, has had problems with alcohol and is now forming a drug habit that is making him paranoid and prone to domestic violence to his wife Valerie (Kathy Burke) who tries to hold the family together but ends up coming off more like a doormat. Meanwhile, her mother Janet (Laila Morse) is aware of Ray's son, Billy (Charlie Creed-Miles) and his escalating drug habit that is sending him off the rails. The film follows these despairable characters as they tredge along with their lives.<br /><br />It is said that the British seem to enjoy being miserable, and that would include watching films that entertain them this way. Films like Nil by Mouth highlight this. It's a tale of a broken family, torn apart by crime, poverty, booze and drugs, the kind Jeremy Kyle would lap up like a three course meal. It is also essentially a tale of self destructive men, three generations apart and each copying the other, tearing a family apart and women trying to hold it together, despite not being strong enough. If you pick up a little of what it's about from the off-set, you can see it doesn't promise to be cheerful viewing from the start and it certainly doesn't disappoint in this.<br /><br />It's true what everyone said about the performances, and the lead stars, Winstone and Burke, do deliver some great acting. We see Winstone lose it with his wife, beating her senseless after some more coke induced paranoia, breaking down during a phone conversation with her and unleashing a typical arsenal of f and c words when she refuses to let him see his kid. Likewise, in a private moment, we see Burke skillfully lose her composure on a staircase, the full impact of the night before kicking in.<br /><br />This is another of those films where there's no 'plot' to follow, as such, just a real life feel of these hopeless lives carrying on from one day to the next. It's been acclaimed by many (including the Baftas!) but it really was just too grim and bleak for me. I have no right to criticize it for this, knowing what I knew about it from the off-set, but sadly this is how I found it. **",negative,1,1,1,0,0,0,0,0,0,0,0,0,0
"Any one who has seen Mel Gibson's The Passion of the Christ and was bothered by the gory violence would want to see this film instead. Though it wasn't a success in th box office or TV ratings, The Fox Movie Channel still finds a real good motive to show this anually. I liked the way that they trained Chris Sarandon and the men who portrayed his disciples to sing in Hebrew.Though Sarandon didn't have long hair like any other Jesus would in other films, his looks are pretty close to what a Jewish man would appear. What surprised me or startled me was the scene where Caiaphas told Jesus about Pilate ""And don't ever forget, that you are a Jew!"" Though that may have not been a racist remark,Colin Blakely was trying to make Chris Sarandon look like garbage in the eyes of the prominent men of those days.Keith Michell's portrayal of Pilate was hulking, comparing with his previous performances in ""The Story of Jacob and Joseph"" and ""The Story of David"". But if you compare his portrayal of Pilate with Telly Savala's or Hurd Hatfield, you can say that he really painted well the impression of a Roman procurator.",positive,0,0,0,0,0,0,0,1,1,0,0,0,1
"Can Scarcely Imagine a Better Movie Than This<br /><br />Hey, before you all go ""Chick Flick"" on me. I am a very Large Strong & Masculine, Macho Man, who happens to think this was one of the better movies of the last 20 years. <br /><br />The acting was Superb and the Story was Marvelous. This is wonderful medicine for the heart and soul. The Acting could not have been better nor the movie better cast. <br /><br />I have known for a Good while that Mercedes Ruehl, along with Holly Hunter, Joan Plowright, Dame Edith Evans, Sissy Spacek, Judi Dench is among the greatest actresses ever to appear on film. And of course Cloris Leachman (also in this film) in my view may in fact exceed them all in the shear magnum of her talent and varied roles she has appeared in over the years.. At any rate this was an Amazing cast. This film was like a book that you cannot lay down, and when you have reached the last page wish for more...still more. I cannot for the life of me understand why this film here on the IMDb only rates a 3.9<br /><br />That rating here is utterly Amazing to me. Or perhaps not. Perhaps in fact I do understand it ever so well and that is what makes me really sad. It makes me ever so sad that films like ""American Beauty"" ""Leaving Las Vegas"" ""Sexy Beast"" and ""Fight Club"" ratings skyrocket off the charts in popularity when they in fact at least in this viewers opinion should have received an ""R"" rating...R that is for ""Rubbish"". Hey o.k., I realize there are a lot of different stories in this world for a lot of different audiences, but it is a sad commentary when this lovely, powerful...extraordinarily, Directed, Acted, and written film seems to be over looked. <br /><br />It obviously was at the Academy Awards as well....How Sad. And How predictable. My summation is that if you want to see a powerful, Happy, Sad, beautiful story? watch ......preferably own this film...",positive,0,0,1,0,0,0,0,0,1,1,0,0,0
"This is a very fine and poetic story. Beautiful scenery. Magnificent music score. I've been twice in Japan last year and the movie gave me this typical Japanese feeling. The movement of the camera is superb, as well as the actors. It goes deep into your feelings without becoming melodramatic. Japanese people are very sensitive and kind and it's all very well brought onto the screen here. The director is playing superb with light an colors and shows the audience that it is also possible to let them enjoy a movie with subtle and fine details. Once you've seen this movie you will want to see more from the same director. It's a real feel good movie and I can only recommend it to everybody.",positive,0,0,0,0,0,0,0,0,1,1,0,0,0
"This movie is about sexual obsession. Bette Davis plays Mildred. This is a woman who men are drawn to. Not because she is a nice beautiful girl but because she is a sexual entity. Now the movie does not come out and say that but it is obvious. There is a scene in the movie in which men are all going googly eyes over her. She works as a waitress in a coffee shop, she can't read and she not really anybody to look at but she is a flirt. It is obvious the male customers in that coffee shop are there because of her. One day Phillip a club footed failed painter medical student comes in the shop to say a good word for his friend but he becomes besotted the moment he sees her. He starts buying her things even pays for her apartment. Meanwhile she is seeing other people and she makes no secrets of it. He dreams about her like she is a angel, but she is no angel. He is constantly thinking about her. His med school grades are even failing. So what the nookie is too good. He wants to marry her but she rejects him because she is marrying another guy. She always lets Phil know she really doesn't have love feelings for him all of time. He is heart broken but he meets another woman. They seem fine but it is obvious he is still dreaming of the Bimbo. Mildred does comes back with a baby and unwed. Phillip takes her in again, but she starts going out with a friend of his, the light bulb comes on a little and he kicks her out. She does what she knows works so she tries to seduce him, well it doesn't work and she proceeds to burn his tuition money up. Oh we have a club foot that he has problems about, even though a street teenager who has the same problem tells him to lighten up about it. He meets another girl named Sally we have a March of time montage which shows her aging while he strings her along still waiting for Mildred. Well he has no school tuition, can't find a job. Finally Sally and her dad takes him in. Not before another March of Time montage showing him going downhill. Soon his uncle who raised him dies and he gets money to become a doctor. Meanwhile he finds Mildred needs him again. She has TB. meanwhile he is still leading Sally down the Primrose path about marriage and he takes a job on a steamship. Finally the bimbo dies and Phillip declares he is free now and he will marry Sally. I wished she told him to stuff it. Now I know my take on the characters are not going to get me any points. But I feel Phillip was the bad guy. Yes Mildred is a Strumpet BUT he knows it, and he keeps coming back. Mean while he has two other girlfriends who love him but he treats as appetizers. I guess the sex wasn't as good. But in any case he dogs those women waiting for Mildred. Not only that but the man who gets Mildred pregnant is already married and when Philip asks him what he intends to do about Baby ( apparently the baby's name) he laughs is off, he has no intention in supporting her and Baby and he is wealthy. Sally's father who has 9 children say some pretty nasty things about women but he is said to be a old traditionalist. Philip doesn't seem to refute his feelings either. Men are using Mildred as a Boy Toy but the men in this movie come out as unscathed. Yes she was not a respectable woman but far from a villain. To me it is Philip who was had the real problem and it was his sexual obsession for Mildred.",positive,1,1,1,0,1,0,0,0,0,0,0,0,1
Hello. This movie is.......well.......okay. Just kidding! ITS AWESOME! It's NOT a Block Buster smash hit. It's not meant to be. But its a big hit in my world. And my sisters. We are rockin' Rollers. GO RAMONES!!!! This is a great movie.............. For ME!,positive,0,0,0,0,0,0,0,0,1,1,0,0,0
"And the Oscar for the most under-rated classic horror actor goes to - Dwight Frye. Seriously his name should be stated with the same awe as Karloff, Lugosi, and Price, and this movie proves it. His character Herman was one of the 2 reasons I can give to watch this movie. Dwight gave this somewhat more than slightly disturbed misfit a lovable yet creepy demeanor that led you hoping for a larger role the entire movie.<br /><br />The other reason is the comic relief of M. Eburne. Being in the medical profession myself I have to give kudos to the expert performance of a self-pity prone hypochondriac. Though other ""medical mistakes"" did give a brief chuckle especially when the good doctor samples his fellow physicians medication... ""Well continue giving it to her"" Unfortunately these 2 outstanding performances could not keep me awake through 3 attempts of sitting through this unbearably slow movie. The plot is predictable with only few minor twists. The filming while pulling off a legitimate spooky atmosphere was more productive at making me yawn - yes you can use too much shadow.<br /><br />My recommendation - watch this once to see Frye and Eburne - but only when wide awake and with lots of caffeine.",negative,0,1,0,0,0,0,0,0,1,1,0,0,0
