Review,Classification,Disgust,Disappointment,Sadness,Confusion,Anger,Fear,Indifference,Surprise,Interest,Happiness,Touched,Motivation,Reflective
"Ride With the Devil has something rich and special, if you can stand the slow development. While tackling a dark, gritty subject, the brutal guerrilla war in the American West during its Civil War (which in turned spawned the outlaws of the old west of the 1870s), the movie maintains a strangely satisfying, unmanipulated atmosphere. What I'm refering to is the tendency of films' music and lighting to make you feel the mood you'd expect to feel. But RWTD instead has a relatively upbeat soundtrack, and lets the words and action do the talking set the mood rather than manipulation of the viewer's senses.<br /><br />As an enthusast of this particular area of CW history, I'm greatly impressed with the accuracy of the film. The diologue is expertly written, (even with subtle humor occasionally) with references to bushwhackers and previous boarder battles (Independence for example...A far cry from the Oregon Trail!). The minor events that occur to Jake's band are similar to actual events that took place...Especially the attack when they're holed up in the house, and the destruction of the store/booth. The battle scenes, though rare, are pretty well executed. It even has the first CW cavalry battle put on film recently.<br /><br />The directing shows the talent everyone expects of Ang Lee in subtle ways. Example: The character of Black John is shown taunting a Lawrence resident during the massacre: ""Where's your army? Who are we to fight!? Who are we to fight?! (The shot then switches to a trio of Confederate Regulars standing, doing nothing to stop the carnage while the voice continues) You are cowards all!"" Who are the cowards, really? Little touches like that really enhance the movie's quality.<br /><br />There are no major glaring areas in the history, something that can not be said of the masterpiece of film Glory, which was basically fiction within the context of the major events it follows. Some minor problems include the fact that the years as shown by the events represented don't add up. But you will never notice that. A larger curiosity is the fact that the only African-American man-at-arms character in the film is the quasi-slave fighting for Jake and his Confederate bushwhackers. It is true that some blacks did fight for the Confederacy out there, including one who scouted Lawrence for Quantrill before the attack (Who would suspect him?). Though this black rebel is a fasinating character (whatever PC African-Americans might think of him), not a single black Union infantryman is seen in the film, which would have been more represenative of the black experience in the Western CW. One of the first black regiments of the CW was raised in Kansas (by the murderer Senator Jim Lane, and before the 54th Mass. Reg. of fame was organized), and black troops in such battles as Baxter Springs, KS, played a critical role.<br /><br />No glaring historical errors. Good, realistic action, which is infrequent and not gratitous. Good Directing. This film may not be the blockbusters other recent Civil War were, but it's the cleanest job of any.",positive,0,0,0,0,0,0,0,0,1,1,0,0,1
"I first saw this movie in the theater when I was 8 years old and it still cracks me up. The Muppets are so cool and they approach show business in a refreshingly naive way. My favorite scene is when the rats start a whispering campaign on behalf of Kermit at a fancy restaurant. This is one smart and funny movie for kids and parents alike. Long live Kermit, Miss Piggy and the rest of the gang.",positive,0,0,0,0,0,0,0,0,1,1,0,0,0
"ANCHORS AWEIGH is an entertaining MGM musical that fans of the genre will enjoy but I wouldn't rate it up there with classics like SINGIN IN THE RAIN or THE BAND WAGON. This was the first of three musicals that Gene Kelly and Frank Sinatra appeared in together. Kelly and Sinatra play Joe Brady and Clarence Doolittle, two sailors on leave in Hollywood who befriend a young boy (Dean Stockwell)who introduces them to his attractive young aunt (Kathryn Grayson) a struggling actress who is working as an extra at MGM. Though both guys are initially attracted to Grayson, she eventually voices a preference to Joe but Clarence later hooks up with a waitress (Pamela Britton)who, he learns is from his hometown of Brooklyn. The paper-thin plot leaves room for several great musical numbers including ""We Hate to Leave"", Joe and Clarence's lament to their fellow sailors as they're leaving the ship; Grayson's torrid rendition of ""Jalousie""; Sinatra's dreamy rendition of ""I Fall in Love Too Easily"" (a number which is sadly deleted from some prints of this film), and ""The Worry Song"", a fantasy dance that Kelly does with animated Jerry the Mouse from Tom and Jerry fame. Kelly also does a sort of Kissing Bandit fantasy ballet which rivals his Pirate's Ballet in the later THE PIRATE. Kelly is in peak form here, in a robust and energetic performance that earned him his only Oscar nomination for Best Actor and Sinatra's endearingly shy character here is undeniably sexy. An entertaining diversion for fans of the MGM musical factory.",positive,0,1,0,0,0,0,1,0,1,1,0,0,0
"Dreyfuss plays a mob boss who lost his mind, but now he's ""fixed."" Lane is his girl who's been messing around with his Number One (Goldblum), who's supposed to have something going with Lane's sister (Barkin).<br /><br />With what anyone could consider an all-star supporting cast (Burt Reynolds, Gabriel Byrne, Kyle MacLachlan and even an appearance by Richard Pryor) can't help this plot, as Dreyfuss proves he's not ""fixed"" and tries to kill just about everyone in sight.<br /><br />You know, it's not like you didn't know what was coming. The first ten minutes were nothing but guys trying to tell Goldblum what was in store for him when Dreyfuss gets out, but I'll save you all the trouble: skip this movie.<br /><br />The actual reason I picked this movie is because I've been on a Diane Lane kick lately and have been trying to see all her movies. The real let-down for me wasn't just the terrible plot, but also the fact that she doesn't show up until the last fifteen minutes of the movie (although we hear about her all through the movie). Even being a fan of over half of the cast can't help me enjoy this film. The parts where the suspense was supposed to mount found me laughing at what was actually going on.<br /><br />3 out of 10 stars.",negative,0,1,1,0,1,0,1,0,0,0,0,0,0
"Though the title includes the word ""zombies"", this film is not what you'd expect from a movie made today, though for 1936 the concept is played out about as well as would probably be expected. Dean Jagger portrays Armand Louque, an officer in the French Army of World War I, who has stumbled upon an ancient tale of soldiers turned into automatons, or ""zombies"", who are impervious in battle and may hold the key to victory in the war, though on whose side is not certain. At first he has trouble convincing his superiors of this phenomenon, but eventually French General Duval (George Cleveland) orders a non military expedition into the ancient Cambodian city of Angkor to find the secret of the zombies and destroy it.<br /><br />The story is played out against the backdrop of a love triangle involving Louque, Duval's daughter Claire (Dorothy Stone), and Clifford Grayson (Robert Noland), all a part of the expedition. When Louque laments over his lack of forcefulness and resolve, Grayson offers him advice to go after what he wants in life with all his power. That advice begins to transform Louque, particularly after he's successful in obtaining a stone tablet resembling a photo from the ancient city. Having followed a temple priest into a swamp, Louque now appears to hold the secret he had been seeking, though it's not made clear how he has instantaneously been able to command the power of ""zombiefication"". All it takes is placing his right fist to the forehead simulating a third eye, and casting his thoughts out to those he wishes to control. This comes in handy for winning back his girl, and taking Grayson's early advice as he comments to his servant, ""Buna, we're learning to be ruthless"".<br /><br />Fans of early ""B"" horror flicks will recognize the use of Bela Lugosi's signature eye stare, plucked from the 1932 film ""White Zombie"", also from director Victor Halperin. Of the two movies, ""White Zombie"" is preferably superior, both in story content and in it's depiction of the undead, where the zombies have a more sinister appearance and are more threatening. In ""Revolt"", the zombies are enemy soldiers with a glazed over look that merely react to their mentor's commands. In fact, the actual revolt of the title occurs only when Louque releases the soldiers from his mental command in deference to his love for Claire; they overrun his compound and kill him in the process.<br /><br />Not to be too harsh on the film, it plays out decently within the parameters of it's story outline, but if you're thinking ""zombies!!!"" within the traditional context, you'll probably be disappointed. If you want to sample an early treatment of the subject, the aforementioned ""White Zombie"" with Bela Lugosi is the way to go.",negative,0,1,0,1,0,0,0,0,0,1,0,0,0
"I only watched the first 30 minutes of this and what I saw was a total piece of crap. The scenes I saw were as bad as an Ed Wood movie. No, it was a hundred times WORSE. Ed Wood has the reputation of being the worst director ever but that's not true; the idiot who directed this junk is the WORST director ever.<br /><br />The American cop has a German accent! The ""police station"" was a desk in a warehouse with a sign ""Police Station"" hanging on the wall. There is a fist fight where the punches clearly miss by about TEN FEET.<br /><br />This cop pulls women over, cuffs them and leads them to a warehouse. He tells his cop partner to wait in the car. Then he comes out of the warehouse carrying a duffel bag. The cop partner thinks maybe something is not right, that his partner might be a bad cop who is murdering these women, but he isn't sure if that is what's happening because - he's a moron! The dialog is totally stupid, the acting is awful, and the characters act in the stupidest manner I have ever seen on screen. It is totally obvious to the cop's partner that he is illegally abducting these women and he is slapping them and taking them into a warehouse and returning to the car with a duffel bag with a body in it, and yet, the partner, who is there all along, doesn't know what is happening! <br /><br />The director of this film is a total hack. I stopped the movie at 30 minutes because I couldn't take it anymore. It has to be one of the WORST movies I have ever started to watch and I won't waste anymore time on it writing this review. <br /><br />Absolutely WORTHLESS.",negative,1,1,0,0,1,0,0,0,0,0,0,0,0
"It's very sad that Lucian Pintilie does not stop making movies. They get worse every time. Niki and Flo (2003) is a depressing stab at the camera. It's unfortunate that from the many movies that are made yearly in Romania , the worst of them get to be sent abroad ( e.g. Chicago International Film Festival). This movie without a plot , acting or script is a waste of time and money. Score: 0.02 out of 10.",negative,0,1,1,0,1,0,0,0,0,0,0,0,0
Cry Freedom' is a movie about how far people will go to find the truth.<br /><br />The first half is an interesting portrayal of an unlikely friendship between activist Steve Biko and Editor Don Woods (played fanatically by Dezel Washington and Kevin Klein). While the second half deals with Woods looking for answers on Biko's death.<br /><br />Although most people favor the first half of the movie which focuses on the unlikely friendship between Biko and Woods'. I found the second half about Don woods struggle to have Biko's story be heard around the world much more interesting.,positive,0,0,0,0,0,0,0,0,1,1,0,0,1
"I was but a babe in arms when George Lucas was wowing the world with his out of this world Saga chronicling the adventures of young Luke Skywalker and the notorious Darth Vadar but even today 20 years on I can appreciate the genius that is Lucas and the incredible imagination he's been blessed with. In A New Hope Lucas showed a new way to tell stories as he introduced us to such memorable characters as the plucky Princess Leia, the Rougish Han Solo and the spirited Luke Skywalker as well as that best loved of villains, the sinister Darth Vadar. In The Empire Strikes Back he went all out to show us Special Effects can add to a tale and managed to something no-one thought you could do on screen. He made a film with no specific end or beginning and it went down a treat. Return of the Jedi is a fitting end to a Saga that will stand the test of time.<br /><br />When The Empire Srtikes Back ended with encasing of the lovable Rouge Han Solo in Carbonite to be delivered to Jabba the Hut and young Luke reeling from the discovery of a terrible truth about his Father we were left with the feeling that things were going from bad to worse. Vadar it seemed had won the day. How we asked could the rebels ever recover from this blow? In Lucas stunning and captivating final chapter we are kept on the edges of our seats from Han's daring rescue from Jabba's palace to the the final climactic battle on the Death Star between Luke and Vadar as Luke struggles between fulfilling his duties as a Jedi and rebel fighter and attempting to reawaken the good he believes is still in his Father's soul.<br /><br />Old friends like the smooth talking Lando Calrissian and the ever lovable Chewbacca reunite for one final battle to end all battles as a new darker more dangerous enemy emerges in the form of the Emperor himself ( played by the brilliant Ian McDiarmiud.How he missed out on an Oscar is a mystery.) desperate to turn Luke to the Dark Side even if it means betraying his apprentice Darth Vadar.All in black with his red eyes,ghostly white disfigured face and sinister laugh he truly is a terrifying addition to the story and is the undisputed Master of the events that unfold. His new and improved Death Star spells disaster for the rebels but the brave group launch one last desperate attack to end the Empire's reign for good. <br /><br />Lucas managed to incorporate three different stories at once and keep the action going so that the audience is riveted. We watch in excitement as Han and Leia attempt to bring down the shield around the Death Star from the forest Moon of Endor with the help of some adorable Ewoks ( who I really do not believe take from the movie at all. In fact I feel they provide a sort reprieve from the tension of the battles at and in the Death Star) and hindered by legions of Stormtroopers and Imperial Officers. We cheer on Lando and the other pilots as they take on the mighty Imperial Fleet and risk life and limb to fly into the Deatn Star to destroy it once and for all. And we watch with bated breath as Vadar and the Emperor attempt to turn Luke to the Dark Side while he in turn tries to turn his Father back.<br /><br />But for me the most difficult and yet compelling battles is that going on inside Darth Vadar. For ROTJ is a battle of emotions and feelings. Vadar is caught between his loyalty to the Emporer and the Empire and his Fatherly inclinations to Luke. Never did I think that a mask could show emotion but some-how one can't but see the confusion and pain on Vadar's face during the final scenes as the Emporer turns on Luke. There is more depth and emotion to Vadar than I believed a villain, especially one more machine then man could have and that I think is what makes him so accessible. He is conflicted. The Apprentice as much as the Master. The Victim as much as the Villain. Without ruining the end too much Vadar's final scene is the most poignant and wonderful in the trilogy.<br /><br />So in conclusion what can I say. George Lucas is the master of the Saga. Star Wars is the most compelling and engaging Sagas I've seen in a long time and I have yet to see another Saga rival it. Return of the Jedi has all the ingredients necessary to provide the ending Lucas masterpiece deserves. It's action, suspense, romance, tragedy, redemption, joy all rolled into one and it's memorable characters, wonderful special effects and catchy music make both a great movie in its own right and an ending that Lucas can be proud of.",positive,0,0,0,0,0,0,0,0,0,1,0,0,1
"If any show in the last ten years deserves a 10, it is this rare gem. It allows us to escape back to a time when things were simpler and more fun. Filled with heart and laughs, this show keeps you laughing through the three decades of difference. The furniture was ugly, the clothes were colorful, and the even the drugs were tolerable. The hair was feathered, the music was accompanied by roller-skates, and in the words of Merle Haggard, ""a joint was a bad place to be"". Take a trip back to the greatest time in American history. Fall in love with characters and the feel good essence of the small town where people were nicer to each other. This classic is on television as much as ""Full House"". Don't miss it, and always remember to ""Shake your groove thing!!!""",positive,0,0,0,0,0,0,0,0,1,1,0,0,0
"I had a personal interest in this movie. When I was 17 and just out of high school I got a job at 20th Century Fox as a member of the Laborers and Hod Carriers Union. At the end of my first day (sweeping the deck of an aircraft carrier) I was told to bring a suitcase the next morning with enough clothes etc. for one or two weeks. When I arrived the next morning a bus was waiting and about 20 of us headed south toward San Diego. Just short of there we stopped at an army base called either Camp Callan or Camp Hahn. Once we were bunked in we went north a few miles into Camp Pendleton, the big Marine base. There, on the beach, we started building what was supposed to be a Japanese Pacific island base. It took us about a week or ten days to complete the installation, which included a water tank, gun entrenchments, sand-bagged trenches and living quarters. All this was at very high pay, sometimes 'golden time', which was triple our regular hourly wage. Our food was also first rate = prime rib at lunch, etc. - which was amazing because it was wartime and very hard to get good meat at home.<br /><br />Once the job was finished I waited eagerly for the movie to come out, which was about eight or ten months later. Then I waited eagerly through two hours of the movie before my handiwork finally came on screen. Then it was no more than three or four minutes (maybe less) of the movie's heroes dive bombing the base and blowing it to smithereens. A bit disappointing, but still fun. <br /><br />In spite of the disappointment I enjoyed the movie and have not seen it since. I learned later that this movie was underwritten by the government and Fox was paid on a cost plus basis, which maybe accounts for our extravagant pay and lifestyle down there. Bob Weverka",positive,0,1,0,0,0,0,0,0,1,0,0,0,0
"One of my favorite shows back in the '70s. As I recall it went to air on Friday (or possibly Saturday)night on the Nine Network (?) here in Australia. Darren McGavin and Simon Oakland were great together.<br /><br />Each episode usually reached a climax with Kolchack having to engage in hand to hand combat with some sort of supernatural opponent. To their credit, the writers made a concerted effort to get away from the usual round of vampires and ghosts as much as possible.<br /><br />I remember one episode in which the adversary was the spirit of an ancient Indian Chief which/who 'came back' as a massive electrical current which started to kill people in a city hospital. The final showdown saw Kolchack trying to short circuit the 'power beast' amidst an explosion of sparks and billowing flames. Oh well .... you had to be there at the time but it was an interesting idea.<br /><br />McGavin always packed a lot of energy and enthusiasm into his roles and this was one of his best.<br /><br />Definitely deserves a place in TV's ""Hall of Fame"". To quote Tony Vincenzo .... 'Kolchack you are ON IT '... Or, in the case of the Hall of Fame,'IN it' !",positive,0,0,0,0,0,0,0,0,1,1,0,0,0
"Anyone with a young boy in the house who won't watch black & white movies should put this on their television set. When the child walks by, wondering what all the on screen shouting and shooting's about, tell him this is a picture for adults and that he isn't big enough to watch it yet. That'll hold him there for a few minutes; director George Stevens and his team will keep him to the end.<br /><br />I think my father did that to me, anyway, and I'm the better man for it. This classic adventure yarn, set in India during the British occupation, features a trio of Army sergeants who find their tight union facing dissolution as one prepares to marry his sweetheart. Help arrives in the form of a vicious Thuggie revolt that the soldiers find themselves united against.<br /><br />""Gunga Din"" was one of the great movies to come out of Hollywood's finest year, 1939. Even more than most great movies from that Golden year, it is entertaining in a very immediate and accessible way. The theme music is instant hummable nirvana. While shot in California, the camera work (the only thing in ""Gunga Din"" that got so much as an Oscar nomination) has a windblown grandeur that feels very much like the Raj of a hundred years before. The battle scenes are shot in a very realistic manner, not too violent but very messy as people fall and shoot and run in all corners of each frame in a way that feels real, not staged like some Cecil B. DeMille Biblical slaughter fest.<br /><br />The script doesn't just set up action scenes, it also develops the relationship of the three sergeants with great dollops of humor. The main focus is on Sgt. Cutter, chasing after tall tales of golden treasures. It's a rare actioner for Cary Grant, and his lightness is just right for a film that never takes itself seriously even as it develops taut suspense.<br /><br />Anchoring the trio is Sgt. MacChesney (Victor McLaglen), who dotes over his elephant Annie and tries to protect Cutter from his own hare-brained schemes. He's just as funny in his own way, leaving Sgt. Ballantine (Douglas Fairbanks Jr., displaying some nice Errol Flynnish dash) as the one with the love interest and grounding enough to know he needs to chuck his boyish pals and grow up.<br /><br />If ""Gunga Din"" was a Lifetime movie, it would be about Joan Fontaine's efforts to save her man from his two loser friends and their skull crushing hijinks. But since it's a guys' film, the accent here is on how the threesome must stay together and save Ballantine from a fate worse than death, not only marriage, but as Cutter indignantly exclaims several times, the tea business, too.<br /><br />The political correctness police are hard on this film, not so much for the gender issue but the idea of British soldiers saving poor Indians from the vicious Thuggies. It reeks of colonial apologia. Thankfully, this film was made back when, and the producers thus felt no need to spell out the obvious liberalism at the heart of the film, that these three sergeants, so full of derring-do and false racial pride, have to be saved along with the rest of their army by a humble bhisti that only one of the three had any time for when he sought their approval. After all, for all their swashbuckling glory, the film's true sacrifice involves the title character, played so heart-wrenchingly by Sam Jaffe.<br /><br />Back when this film was made, movie mogul Jack Warner had a saying: You want to send a message, use Western Union. Still, it seems like the messages were flying fast and furious in ""Gunga Din."" I watch the film now and wonder if audiences back then were meant to wonder what Gunga Din was really up to when he led Cutter to the golden temple. Was he really plotting revenge against his British overlords? Would he have been justified in doing so, especially given MacChesney's cold treatment of him? When Col. Weed delivers that eulogy, the poem by Rudyard Kipling on which the film is loosely based, was it with a nod in the direction of imperialism's folly, of lording it over someone who proved ""a better man than I am"" in the end? What did they make of the Guru's great speech, delivered in perfect clipped English: ""You have sworn an oath as soldiers to maybe die for a faith, which is your country, England. Well, I can die for my country and my faith as readily as you...India, farewell.""<br /><br />Of course, the same character also instructs his brutal followers: ""Kill for the love of killing! Kill for the love of Kali! Kill! Kill! Kill!"" Which means we are allowed to hate him and root for the British, and save the questions about what it all means for later.<br /><br />What ""Gunga Din"" means to me, most of all, is the quickest, surest 90-minute thrill ride on video. Cutter never found his golden temple, but there's one for all of us watching ""Gunga Din.""",positive,0,0,0,0,0,0,0,0,1,1,0,0,1
