Review,Classification,Disgust,Disappointment,Sadness,Confusion,Anger,Fear,Indifference,Surprise,Interest,Happiness,Touched,Motivation,Reflective
"Let me say first that this show was top tier when John Ritter was there. Upon his death, the show did drop off a bit, but the producers didn't give up on the show, adding James Garner and David Spade to the regular cast from 2003 to 2005.<br /><br />The show centers around the Hennessy family, Paul (John Ritter, may he rest in peace), his wife Cate (Katey Sagal), their daughters Bridget (Kaley Cuoco), Kerry (Amy Davidson), and their son, Rory (Martin Spanjers). When Ritter was on the show, I would shriek in laughter (and proud to admit it, I am), but now that he's gone, I'll only laugh a little with the occasional hearty laugh. I'm very glad that I fell for this show's trance after Ritter's untimely death, because it made the eps with Ritter so much better.<br /><br />Ritter's character is just so well acted and well rounded, that you can't help but love him. He is always bossing the girls around about dating, but he really wants them to be happy. It's the ultimate daddy hates boyfriend entertainment.<br /><br />Katey Sagal is great as well, and she too is a likable character. After Ritter's death, her character provides such good influence and strength for not only her kids, but I believe Sagal has shaped the lives of Cuoco, Davidson, and Spanjers, because she and Ritter had been friends for a long time.<br /><br />The funniest person on the show would have to be Bridget Hennessy, played by Kaley Cuoco. She is the ultimate blonde: gorgeous, slow, dim-witted, yet she is a smart person. She is off the wall hilarious with her innocent 'blonde' humor and how conceited she is.<br /><br />Amy Davidson can get a tad annoying as Kerry, but that's the purpose of her character. The only fault of the show is that the show never really gives Kerry anything to be happy about. She's always after Bridget, and her character feels like it's just thrown in there.<br /><br />Martin Spanjers as the lone Hennessy son is hysterical, and when Ritter is on the show, he's mostly comic material. Upon the death of Ritter, the show does provide some story lines for Rory.<br /><br />David Spade and James Garner are all nothing but laughs, with the occasional side story for C.J., Spade's character. Garner plays Cate's father, as a bit of background information.<br /><br />All in all, I give this show a great review because it is a great show that had a tragic event happen that crippled it. You'll enjoy it.<br /><br />9/10 --spy",positive,0,0,0,0,0,0,0,0,1,1,0,0,0
"William Shatner in small doses is tolerable. Unfortunately, instead of leaving his character as a minor irritation, and in that moderately amusing, it has been seen fit to enlarge his role and overdo it. Just as occurred in the original Star Trek series. I guess I will never understand American humour, which frequently goes 'over the top' to get the message through. I vote with my feet. I no longer watch the show, which is a shame, because the rest of the cast were good. It is pity that Shatner's overdone role also, affects James Spader's performance. But the majority demonstrate the way society is going, I guess. I don't travel the same routes. Frank",negative,0,1,0,0,0,0,0,0,0,0,0,0,0
"John Carpenter's career is over if this sad excuse for a movie is any indication. His excuse is that he only produced it. Jon Bon Jovi looks like a girl. In fact, Bon Jovi and the two Vampire girls, Natasha Wagner and Arly Jover probably all fit in the same clothes. In short, it was hard to tell which one was cuter in an anorexic ramp-model sort of way. Bon Jovi has the most charisma. At least he looks happy when he is smiling. The two Vampire Girls on the other hand are all cramps and complaints. At one point they are about to give each other a wet kiss, but stop. Amazing how each Vampire movie has some set of morays for the respective vampires. At one point, Arly Jover is providing fellatio to a very dumb Vampire Hunter and then she sucks his blood while doing the sex act. It would have been an erotic moment except that it was filmed like a total goof, and the male actor looked mildly amused as he watched Arly Jover move her head to mimic something that was very obviously not happening. As far as gore is concerned, a few heads are ripped off, and the blood spurts profusely. These scenes have so little suspense or build-up that when they happen it is almost funny, and there is no ""horror"" pay-off from the scene. All you get as a member of the audience is a feeling of ""Wow, that sure was a lot of red paint splattering on the walls. I wonder who has to clean it up."" Throughout the movie, these Vampire Hunters who are obviously trying to kill Arly Jover (the top vampire in the world??) keep reaching out to her. At one point, Bon Jovi goes into the abandoned Church and after he just shot her with an arrow (and has done so on other occasions), he says ""I am not trying to hurt you. I just want to talk to you. I want to get to know you."" HUH?? Of course, the dumb vampire Arly jumps out to say hello and Bon Jovi sticks her again with another impaling device. ""Why Can't We Be Friends"" the 1970s hit song by WAR should have been the theme song for this movie. Aside from all of the other silly moments, there is a transfusion sequence when Natasha Wagner has all her Vampire blood removed, and the town people all line up to donate blood for her transfusion. I guess Blood Type is not important? Anyhow, all her Vampire blood is removed. Bon Jovi then decides that if that blood is transfused into him, he can beat Arly by becoming a vampire also. Of course, as the vampire blood is transfused into him, none of his healthy blood is removed. So apparently Bon Jovi is walking around with twice as much blood as any human can have in his body. And just like the first VAMPIRES, this one also has the vampires-bursting-into-flames special effect.",negative,1,1,0,0,0,0,0,0,0,0,0,0,0
"The comparison to Sleuth, the earlier stage-play-turned-film, is obvious and upon my first viewing I too thought Sleuth was better, but Deathtrap has, at least for me, many more repeat viewings in it than Sleuth.<br /><br />I purchased Deathrap in the bargain bin at Wal-Mart, figuring that it had Caine and the underrated Reeve and was worth the 6 bucks. It was one of the finest DVD purchases I could've picked up.<br /><br />It's one of those best-kept-secrets that movie buffs always are always delighted to discover. And it's totally worth repeat viewings.<br /><br />Though Laurence Olivier and Michael Caine turned in bravado performances in Sleuth, I was doubly impressed with Christopher Reeve as Clifford Anderson. Reeve, rightfully associated with his now legendary portrayal of Superman, stole the show in what should've been an Oscar worthy performance. I've always felt Reeve was a type-cast actor who didn't get much of a chance to shine outside of the Superman films and a few other flawed but entertaining films like Somewhere in Time, but this film shows that his potential was truly tapped and put to use, thank goodness.<br /><br />I absolutely relished Michael Caine's performance. He was glib, deliciously manipulative and sadistic. And watching him work with Reeve and Dyan Cannon was an absolute pleasure. In fact, it was thanks to this movie that I got into a ""Michael Caine phase"" and started renting as much of his stuff as humanly possible. <br /><br />As for Deathtrap, there's enough juicy dialogue in here to fill up its ""memorable quotes"" section. (Unfortunately, much of the dialogue would inherently spoil the immensely entertaining plot).<br /><br />It's really, really hard to talk about the movie without spoiling important plot points that are infinitely more fun to discover on your own. Needless to say, it's a must-see. But for me, it was the greatest and most rewarding blind purchase of all time.<br /><br />Repeat viewings are a must. <br /><br />And it deserves to sit alongside Sleuth on your DVD shelf.<br /><br />I'll leave you with this beautifully written quote from the film: ""I wonder if it wouldn't be...well...just a trifle starry-eyed of me to enter into such a risky and exciting collaboration...where I could count on no sense of moral obligation...whatsoever.""",positive,0,0,0,0,0,0,0,0,0,1,0,0,1
"I have watched 3 episodes of Caveman, and I have no idea why I continue except maybe waiting for it to get better. <br /><br />To me this show is just pumping itself off the commercials, with no real humor. As we sat around watching these shows, we all speculated on what was going to happen.<br /><br />The episode of the woman cave-woman with a attitude was actually a big, yea right, for us. she's crude in a theater and acts tough to strangers, and truth be told, she needed a slap<br /><br />I consider myself a pretty good reviewer, taking in everything, but I must say, Cavemen is comparable to the old show, My mother, the car. I give it a 2, only because they deserve 1 better than a 1 because they actually spent money on it.",negative,0,1,0,0,0,0,0,0,0,0,0,0,0
"The Russian movie, ""4,"" follows the lives of three (not four) strangers who meet one night in a local bar. One is a musician, one a frozen meat seller and one a call girl.<br /><br />""4,"" I gather, is intended to showcase the dreariness and hopelessness of life in post-Soviet Russia (the characters have to make up stories to make their lives appear more interesting than they really are), but the movie is so incoherent and boring that I seriously doubt very many people will be able to sit all the way through it. There seems to be a suggestion running through the film that the shadowy Russian government is up to some shady doings behind the scenes - operating secret cloning facilities, selling decades-old frozen meat etc. - but the movie is so formless and incomprehensible that I doubt anyone could figure out what anybody's really up to here.<br /><br />Despite decent acting and a few incisively directed scenes, ""4"" is a two-hour long endurance contest that should be avoided at all costs.",negative,0,1,0,0,1,0,0,0,0,0,0,0,0
"Very bad acting, and a very shallow story. Not even a decent B-Movie<br /><br />Events that were suposed to be shocking like humans geting on board an alien ship were boring and very lame.<br /><br />This is one of the worst sci-fi I've ever seen. I saw the 5.0 stars and decided to watch it since i like the genre, but it sucked so bad.<br /><br />Now there's really very few good movies on ALIEN subject, I think because most of them are low budget<br /><br />I give it 3/10",negative,0,1,0,0,1,0,0,0,0,0,0,0,0
This movie is the next segment in the pokemon movies which supplies everything on hopes and dreams of a pokemon warrior named Ash Ketchim and his friends. they go out and they look battle and run into new pokemon and take on new adventures with Pikachu and other pokemon favorites. This adventure takes on with a new pokemon called Celebi a time pokemon. Go join ash Brock and Misty to find all sorts of new things!,positive,0,0,0,0,0,0,0,0,0,1,0,0,0
"Forbidden Planet represents the kind of science fiction that is precious in cinema, especially from the 1950s. There was The Day the Earth Stood Still and War of the Worlds, but lest not forget this gem which took some of its story from Shakespeare's The Tempest to tell a tale of astronauts on a planet that has a doctor on it who has made a remarkable breakthrough. It's the kind of breakthrough that is not so much incredible to look at (though for 1956 it does look quite amazing to look at some of those sets and that gigantic machine the doctor creates), but with its emphasis on the characters and its themes of technology taken too far by the more primitive side of human nature even when we don't know we're channeling it.<br /><br />On the surface- that is in the first ten minutes- it looks standard, if a little more professionally acted and directed with better skill than the B-movies of the period. A ship of astronauts are on a mission to the planet Altair-4 to bring back an expedition that went missing decades before. But the only one left is Dr. Morbis (Walter Pidgeon) and his daughter, who somehow were immune to an attack that left everyone else dead. Morbius appears to be a cordial and highly intelligent man, and his technology looks to be so impressive that the only thing the astronauts, led by the Skipper (Leslie Nielsen), can think to do is to report it back to their superiors on Earth.<br /><br />But there's a catch - something is killing off members of the crew of the ship, one by one, every night, even when the others keep an eye out and then put up an invisible electric fence, which the invisible something goes through easily. Meanwhile, there's some romance possibly between the Skipper and Alraira, and there's a more pushy vibe from the doctor: you shouldn't have come to the planet to start, and now you need to go. What happens from this is even more fascinating, just on a purely intellectual level, but Forbidden Planet never forgets that its audience should also be entertained by this story while getting some useful ideas. While everyone may remember Robbie the Robot, and for good reason, perhaps the most unforgettable image for me is the monster realized on screen with the crew firing to no avail, animated with red electricity and looking so beastly that it looks out of Fantasia.<br /><br />The acting from Pidgeon is subtle: you wouldn't expect him to be a villain, though something is there in the character and in the performance that speaks to this, and by the end it makes the character far more complex than one would expect. And the other performances are workmanlike but also excellent, from Nielsen as a born leader to Holliman providing some great comic relief as the Cook (who, I should add, helps with one of the funniest scenes in the film with those gallons of bourbon Robbie provides). And the effects for its time are extraordinary (sophisticated in a nostalgic pulp way for today too), and the music, done by electronics, is beautiful in its ""tones"". But ultimately it's the screenplay and careful direction from Hilcox that puts this a notch above the rest of the B-movie lot. When it's meant to be funny, it's intentionally so and it works. When it's dramatic it connects quite well even in its stiff moments with the actors. And when we are made to think about a horrible situation, it comes on gradually, with nuance, not shoved in our faces or injected with mega-action.<br /><br />An inspiration for many other sci-fi films, and a fine marker of thoughtful science fiction stories and books from time-old, it's a classy and entertaining classic.",positive,0,0,0,0,0,0,0,0,1,0,0,0,1
"I read John Everingham's story years ago in Reader's Digest, and I remember thinking what a great movie it would make. And it probably would have been had Michael Landon never got his hands on it. As far as I'm concerned, Landon was one of the worst actors on earth, and his artistic license went way over the top, similar to his massacre of the ""Little House"" book series is proof. The acting, for lack of a better word, is atrocious, the screenplay sloppy, and there are more close-ups of Landon's puss than should be allowed.<br /><br />This movie reflects Everingham's story as much as ""Little House On The Prairie"" reflects the books is was ""based"" on. It's just another vehicle to show off Landons horrendous hair.",negative,0,1,0,0,0,0,0,0,0,0,0,0,0
"DOCTEUR PETIOT, starring Michel Serrault, is a brutal story about a brutal man. A doctor who heals the sick in occupied France, even if their ability to compensate is not there. Yet, he preys on the weakest amidst the populace. The imagery and cinematography are superb, and lend an additional macabre feeling to this complex story. He is the perfect psychopath. Seductive and altruistic, intelligent and caring, calculating and murderous. A movie certain not to be forgotten soon by the viewer. Kudos to Mr. Serrault, for his chilling portrayal.",positive,0,0,0,0,0,0,0,0,1,1,0,0,1
"Grey Gardens is shocking, amusing, sad and mesmerizing. I watched in amazement as Ediths Jr. and Sr. bickered and performed while reminiscing of their past. Their existence in a dilapidated mansion, (which they had not left for more than fifteen years) is both a comedy and a tragedy. This is a film you will not soon forget.",positive,0,0,0,0,0,0,0,1,1,1,0,0,0
"Walt Disney's CINDERELLA takes a story everybody's familiar with and embellishes it with humor and suspense, while retaining the tale's essential charm. Disney's artists provide the film with an appealing storybook look that emanates delectable fairy tale atmosphere. It is beautifully, if conventionally, animated; the highlight being the captivating scene where the Fairy Godmother transforms a pumpkin into a majestic coach and Cinderella's rags to a gorgeous gown. Mack David, Al Hoffman, and Jerry Livingston provide lovely songs like ""A Dream Is a Wish Your Heart Makes"" and ""Bibbidi-Bobbidi-Boo"" that enhance both the scenario and the characters.<br /><br />Even though CINDERELLA's story is predictable, it provides such thrilling melodrama that one shares the concerns and anxieties of the titular heroine and her animal friends. Both the wicked stepmother and her dreadful cat Lucifer present a formidable menace that threatens the dreams and aspirations of Cinderella and the mice. It is this menace that provides the story with a strong conflict that holds the viewers' interest. The film's suspense, however, is nicely balanced by a serene sweetness, especially in the musical numbers. It is in these segments that reveal the appealing personalities of Cinderella and her friends, moving the viewers to care for them. Overall, Walt Disney's CINDERELLA is wonderful family entertainment that has held up remarkably well after half a century.",positive,0,0,0,0,0,0,0,0,0,1,0,0,0
"Eskimo is a serious movie about the cultural chasm between an indigenous population and the encroaching white man. Although filmed in a documentary style seemingly with non-professionals, Eskimo is a skilled production that contains a believable story the audience will want to see through to the final shot.<br /><br />The native Eskimo simply has different beliefs and behaviors about women and life than do the whalers that darken his landscape. When an Eskimo man loses his mate, it is natural that other men share their women with their friend. It is also usual for their women to want to take the place of the missing spouse. All of this seems natural in the context of the desolate foreboding Arctic setting. The trusting Eskimo falls prey to unscrupulous white whalers (with heavy European accents) that do not view these natives as their equals. Deceit, drunken orgies, rape, and death occur after the Eskimo men depart for work on the icy cold seas. Eventually the lead Eskimo (Mala) realizes that he has been duped and he takes his revenge. The audience would have cheered in the 1930's theaters.<br /><br />Enter the Royal Canadian Mounted Police and the moral dilemma of whether to bring back Mala for trial. The Mounties are played as feeling policemen that know this is not a cut and dry case. Will the Mounties get their man? Is it fair to hold Mala to a code of behavior outside of his traditional society? Is there a way out that does not punish Mala? Is it inevitable that the white man's law must prevail? Is there no hope for innocence?<br /><br />This is not a great movie, but one that you will enjoy for the depth of the issue addressed in a very different setting. I suspect that the filming of the sequences with animals was done before today's disclaimer that none were injured in the making of the film -- so beware of the raw nature sequences. Highly recommended.",positive,0,0,0,0,0,0,0,0,1,0,0,0,1
"I finally sat down and saw this film the whole way through, and I must say, I was very impressed. Michelle Rodriguez is probably one of my new favorite actresses---it's not only the fact that she *can* act, but that she chooses the roles best suited to her that are more meaningful and important than what would first seem. I've read a few comments expressing their relief that this was not some awful feminist thing as they thought beforehand, but I certainly disagree. Diana is a feminist. She follows her dreams and believes in herself contrary to what practically everyone around her thinks (with the exception of her caring brother Tiny and her trainer and manager, Hector, who proves to be more a father figure than her real parent), which is what the word ""Feminism"" is all about. It's good to see films like this showcasing the true side of feminism--that they're not a bunch of manhating losers--but that they have dreams and can do anything. Diana is true to herself while still falling prey to love, and she and Adrian have a more realistic, complicated relationship rather than just something that magically works out. Girlfight is a true taste of reality and it put some faith back into my perception of people. Thanks, Michelle.<br /><br />8/10 - A very important movie that's relatable to not just young women, but everyone wanting to go far in their lives.",positive,0,0,0,0,0,0,0,0,1,1,0,0,1
"One of my favorite movies, with a very nostalgic ending. The movie is about the Sullivan family, obviously Michael Sullivan (the father) is one of the main members of the mafia, the killer to say it this way, and an expert one. One of the kids wants to know the work of his father (a terrible mistake), so he hides on his father's car and well, he sees Tom Hanks in action to say it this way.<br /><br />Mafia doesn't rules, in Mafia nobody wins, when they want you out, they take you out. Of course you can see anyone who works at the mafia with a giant house, the best car in the world, whatever you like, but make a wrong work, or make something your ""boss"" doesn't want, and you're fired, and killed.<br /><br />You can see what I mean in the movie, Sullivan Jr. sees something he didn't had to see, and well, almost all his family gets killed for that ""wrong thing"" his son did. The movie is really entertaining, you see how the Sullivan's live after being chased by the mafia, or kinda of that.<br /><br />This movie is kinda of sad, shows us about revenge, those dirty works people do, almost everything you like. Hopefully the guy is reading this comment doesn't works for the mafia, and if you work at the mafia make yourself a favor and get the hell out of the country before you get killed by your boss and their workers.<br /><br />This movie receives: 10/10",positive,0,0,1,0,0,0,0,0,1,0,0,0,1
"When I was a teen-ager seeing this film for the first time, I thought it was one of the best movies ever made. Of course, the reason for that is Bo Derek and her various states of undress in this film. However, now that I'm older, I can honestly say that this film is awful. Mind you, Bo Derek is absolutely incredibly beautiful, and she and husband-director John Derek make sure you see plenty of her. But when you take that aspect out of the film, it becomes one big dull ride. And Tarzan, well, he's all muscular like you think he should be, but when he sees Jane (that's Bo, of course) for the first time, he doesn't know what to think. This despite the fact that Bo is wearing a wet see-thru shirt, with her breast prominently displayed. Tarzan would be the only primitive man on the planet who would have that problem. If you are looking for a movie to slobber over a beautiful naked body, then this might fill the ticket. If you are looking for a thoughtful, entertaining and worth-while film, go elsewhere...almost anywhere else at that!!!",negative,0,1,0,0,0,0,1,0,0,0,0,0,0
"Maiden Voyage is just that. I'd like to say straight away that I watched 5mins of this before I just couldn't stand it anymore. As already stated in another comment, this film doesn't fall into the whole ""so bad it's good"" thing, it's just bad. The acting is awful, the sfx are poor, and the story is bland and stupid. Even the extras suck, the ""bag guy guards"" and such appear to hold their weapons like water pistols.<br /><br />Don't even bother watching this film, the only thing special about it is that, no matter how low your expectations are, you will still be disappointed.",negative,0,1,0,0,0,0,0,0,0,0,0,0,0
"This movie will always be a Broadway and Movie classic, as long as there are still people who sing, dance, and act.",positive,0,0,0,0,0,0,0,0,1,1,0,0,0
"For years we've been watching every horror film that comes out, from the dull Hollywood retreads like Saw 2, to awful indie releases that are completely unmatchable... we suffer through all of bad films in hopes of finding little gems like ""Dark Remains"".<br /><br />We managed to catch a screening of this film at Shriekfest 2005. The audience loved it and I believe it ended up winning the award for the best film.<br /><br />While it may not have the budget or star power of studio films, it packs a serious punch in the creepy atmosphere and scare category. The acting and cinematography are top notch, but it's the direction that makes this film worth the view. The story and characters develop at just the right pace to provide some fantastic scares.<br /><br />The editing and visual fx are also top notch. And while many horror films don't manage to use music to their benefit, the score for ""Dark Remains"" only adds to it's creepiness.<br /><br />I know the film has shown at a bunch of festivals, but none have been near me, so I can't wait to hear when it'll finally be coming out on DVD. Trust me, even if you're sick of the current state of horror films, give this one a try... you won't regret it!",positive,0,0,0,0,0,0,0,0,1,0,0,0,0
